date,title,source,link
20.03.25,Appeals court rules Trump administration can fire thousands of probationary federal workers,The New York Post,https://nypost.com/2025/04/09/us-news/appeals-court-rules-trump-administration-can-fire-thousands-of-probationary-federal-workers/
20.03.25,US Steel shares tumble after Trump speaks out on possible sale to Japanese owner,The New York Post,https://nypost.com/2025/04/09/business/trump-sends-us-steel-shares-shares-tumbling-with-shocking-comment/
20.03.25,NYC shoppers stock up as Trump's tariffs loom: 'Pray to God that we all survive',The New York Post,https://nypost.com/2025/04/09/us-news/nyc-shoppers-are-starting-to-stock-up-as-trumps-tariffs-start-to-bite-pray-to-god-that-we-all-survive/
20.03.25,NY still 'on notice' to end congestion pricing this month -- but it's unclear what Trump admin will do if MTA blows deadline,The New York Post,https://nypost.com/2025/04/09/us-news/ny-still-on-notice-to-end-congestion-pricing-this-month-but-its-unclear-what-trump-admin-will-do-if-mta-blows-deadline/
20.03.25,"How Trump Connected With So Many Americans

Donald Trump’s campaign was a blend of comedy, fury, optimism, darkness and cynicism. “He gets us,” some voters concluded.

By Shawn McCreesh

PRINT EDITIONSeeing Up Close Why Trump ‘Gets Us’‘|November 8, 2024, Page A1",The New York Times,https://www.nytimes.com/2024/11/06/us/elections/donald-trump-supporters.html?searchResultPosition=1
20.03.25,"Trump Assails Judge and Concedes a Role in Valuing His Empire’s Property

The former president, who railed against New York’s attorney general while testifying before a packed courtroom, denied he committed fraud and called the fraud trial “very unfair.”

By Jonah E. Bromwich and Ben Protess

PRINT EDITIONTrump Slams His Accusers On the Stand|November 7, 2023, Page A1",The New York Times,https://www.nytimes.com/2023/11/06/nyregion/trump-fraud-trial-testimony.html?searchResultPosition=2
20.03.25,"Manhattan D.A. Suggests Freezing Trump’s Case While He Is President

With President-elect Donald J. Trump’s sentencing on hold, his lawyers are pushing to dismiss the case. The district attorney, Alvin L. Bragg, is opposing the effort.

By Ben Protess, Kate Christobek and Jonah E. Bromwich

PRINT EDITIONOfficials Propose 4-Year Freeze on Trump’s Case|November 20, 2024, Page A1",The New York Times,https://www.nytimes.com/2024/11/19/nyregion/trump-bragg-manhattan-case.html?searchResultPosition=3
20.03.25,"Trump Threatens Tariffs Over Immigration, Drugs and Greenland

The president is increasingly threatening other countries with tariffs for issues that have little to do with trade.

By Ana Swanson and Alan Rappeport

PRINT EDITIONTrump Threats Promise Tariffs For Any Cause|January 29, 2025, Page A1",The New York Times,https://www.nytimes.com/2025/01/28/us/politics/trump-tariffs-colombia-canada-greenland.html?searchResultPosition=4
20.03.25,"Here’s the latest.

By Michael Gold, Julian E. Barnes and Simon J. Levien

PRINT EDITIONTRUMP HURT, BUT SAFE, AFTER A SHOOTING|July 14, 2024, Page A1",The New York Times,https://www.nytimes.com/live/2024/07/13/us/biden-trump-election/trump-rally-pennsylvania?searchResultPosition=5
20.03.25,"Trump’s Fraud Trial Starts With Attacks on Attorney General and Judge

Donald J. Trump appeared in court as lawyers for New York’s attorney general, Letitia James, painted him as a fraudster. His lawyers said she was out to get the former president.

By Ben Protess, Jonah E. Bromwich and Kate Christobek

PRINT EDITIONAccusing Trump, New York Starts Civil Fraud Trial|October 3, 2023, Page A1",The New York Times,https://www.nytimes.com/2023/10/02/nyregion/trump-fraud-trial-letitia-james.html?searchResultPosition=6
20.03.25,"For Trump, a Vindication for the Man and His Movement

Donald John Trump took the oath of office again during a ceremony in the Capitol, promising a new “golden age of America” four years after he was evicted by voters.

By Peter Baker

PRINT EDITIONTrump Caps Return To Power, Vowing To Stop A U.S. ‘Decline’|January 21, 2025, Page A1",The New York Times,https://www.nytimes.com/2025/01/20/us/politics/trump-inauguration.html?searchResultPosition=7
20.03.25,"Judge Upholds Trump’s Conviction but Signals No Jail Time

The New York judge who oversaw President-elect Donald J. Trump’s hush-money trial scheduled his sentencing for Jan. 10. Mr. Trump is expected to appeal his conviction.

By Ben Protess and Kate Christobek

PRINT EDITIONA New York Judge Upholds Trump’s Conviction|January 4, 2025, Page A1",The New York Times,https://www.nytimes.com/2025/01/03/nyregion/trump-sentencing-hush-money-case-ny.html?searchResultPosition=8
20.03.25,"Trump Has Few Ways to Overturn His Conviction as a New York Felon

The judge in Donald J. Trump’s case closed off many avenues of appeal, experts said, though his lawyers might challenge the novel theory at the case’s center.

By Ben Protess, William K. Rashbaum and Jonah E. Bromwich

PRINT EDITIONFor Trump and Rivals, Path Ahead Is Unclear After His Guilty Verdict|June 2, 2024, Page A1",The New York Times,https://www.nytimes.com/2024/06/01/nyregion/trump-appeal-conviction.html?searchResultPosition=9
20.03.25,"Trump Targets a Growing List of Those He Sees as Disloyal

In his first month in office, the president has carried out a campaign of retribution that has little analogue in history.

By Luke Broadwater

PRINT EDITIONTrump Casts Wide Net in Pursuit of Retribution|February 18, 2025, Page A1",The New York Times,https://www.nytimes.com/2025/02/17/us/politics/trump-retribution-list.html?searchResultPosition=10
20.03.25,"ASL stream of Donald Trump's presidential inauguration

Watch CBS News Copyright ©2025 CBS Interactive Inc. All rights reserved.

JAN 20, 2025",CBS News,https://www.cbsnews.com/live/cbsnews-3/?intcid=CNM-00-10abd1h
20.03.25,"Trump tariffs are ""negotiating strategy,"" Treasury chief Bessent says

The sweeping tariffs President Trump announced last week were a ""negotiating strategy,"" Treasury Secretary Scott Bessent suggested Wednesday as the president announced a 90-day pause on most of those

11H AGO",CBS News,https://www.cbsnews.com/colorado/news/trump-tariffs-negotiating-strategy-treasury-secretary-scott-bessent-pause/?intcid=CNM-00-10abd1h
20.03.25,"Trump offers rare praise for Michigan Gov. Whitmer after White House meeting

Michigan Gov. Gretchen Whitmer, a potential 2028 White House candidate, stood awkwardly in the Oval Office as President Donald Trump signed executive orders and assailed his political opponents on Wed

3H AGO",CBS News,https://www.cbsnews.com/detroit/news/trump-praises-michigan-gov-whitmer-after-white-house-meeting/?intcid=CNM-00-10abd1h
20.03.25,"House GOP holdouts resist Trump pressure on budget plan, delaying vote

Washington — House Speaker Mike Johnson delayed a vote on a Republican budget plan, lacking enough GOP support to get it over the finish line on Wednesday. Several House Republicans have resisted incr

7H AGO",CBS News,https://www.cbsnews.com/news/trump-presses-house-gop-to-back-budget-plan/?intcid=CNM-00-10abd1h
20.03.25,"H.R. McMaster receives accidental call from President Trump

Just over a month ago, retired Lt. Gen. H.R. McMaster received an unexpected call on his personal cell, four sources told CBS News. It was from the White House and he was instructed by the voice on th

8H AGO",CBS News,https://www.cbsnews.com/news/h-r-mcmaster-trump-accidental-call/?intcid=CNM-00-10abd1h
20.03.25,"See the full list of reciprocal tariffs by country from Trump's chart

A global trade war is brewing as the U.S. imposes tariffs on a growing list of countries, heightening concerns about economic growth and roiling stock markets around the world. President Trump on Apri

12H AGO",CBS News,https://www.cbsnews.com/news/trump-reciprocal-tariffs-liberation-day-list/?intcid=CNM-00-10abd1h
20.03.25,"What Trump has said about tariffs as stock market reacts

President Trump has vehemently defended the sweeping tariffs unveiled by his administration on what he dubbed ""Liberation Day"" last week, even as they threaten to spark a global trade war and have sen

12H AGO",CBS News,https://www.cbsnews.com/news/what-trump-has-said-tariffs-stock-market/?intcid=CNM-00-10abd1h
20.03.25,"Michigan Gov. Gretchen Whitmer to meet today with President Trump

Michigan Gov. Gretchen Whitmer will visit the White House on Wednesday to meet with President Trump. Whitmer, a member of the Democratic Party currently serving her second term as governor, met with M

16H AGO",CBS News,https://www.cbsnews.com/detroit/news/gretchen-whitmer-trump-meeting/?intcid=CNM-00-10abd1h
20.03.25,"How much could Trump's tariffs hike the price of your wine and whisky?

London — Producers and importers of alcoholic beverages say President Trump's so-called ""Liberation Day"" tariffs will hit many American drinkers right in the wallet, with price hikes on some favored t

19H AGO",CBS News,https://www.cbsnews.com/pittsburgh/news/trump-tariffs-europe-wine-scotch-whisky-higher-prices-american-consumer/?intcid=CNM-00-10abd1h
20.03.25,"Trump's would-be assassin sought weapon to shoot down his plane, DOJ says

Federal prosecutors say Ryan Routh, the man accused of trying to assassinate President Trump as he golfed last September during the 2024 campaign, also attempted to acquire an anti-aircraft weapon to

23H AGO",CBS News,https://www.cbsnews.com/miami/news/trump-ryan-routh-assassin-weapon-plane/?intcid=CNM-00-10abd1h
20.03.25,"President Trump's New York fraud debt tops $500 million

President Trump's debt to New York from a civil fraud judgment passed $500 million on Tuesday, as interest continues to accrue while he appeals. The figure has been growing ever since a lengthy civil

APR 8, 2025",CBS News,https://www.cbsnews.com/newyork/news/donald-trump-new-york-fraud-debt-500-million/?intcid=CNM-00-10abd1h
20.03.25,"Stock market soars after Trump announces pause latest tariffs

The stock market exploded higher on Wednesday to one of their best days in history after President Trump said he would place a 90-day pause on his ""reciprocal tariffs,"" adding that he would lower that

7H AGO",CBS News,https://www.cbsnews.com/colorado/news/stock-market-today-dow-jones-china-tariffs-trump-04-09-25/?intcid=CNM-00-10abd1h
20.03.25,"Trump orders probes of two former officials who defied him
President Trump directed federal agencies to revoke the security clearances and review the activities of Christopher Krebs and Miles Taylor.
Apr 09, 2025",NBC,https://www.nbcnews.com/politics/national-security/trump-orders-probes-two-former-officials-defied-rcna200523
20.03.25,"Experts, critics raise questions after Trump says 'this is a great time to buy' before pausing tariffs
In the wake of President Donald Trump’s announcement Wednesday afternoon that he was pausing country-by-country tariffs by 90 days, some experts — as well as critics of Trump and social media users — are raising questions about a statement he posted earlier in the day that may have indicated the massive sell-off in stocks in recent days was coming to an end.
Apr 09, 2025",NBC,https://www.nbcnews.com/business/markets/trump-tariff-pause-experts-question-timing-trump-social-media-posts-rcna200526
20.03.25,"'Con man' vs. 'anti-Trump': Years of Republican fighting fuel a nasty Senate primary in Texas
Texas Attorney General Ken Paxton’s attempt to topple Republican Sen.
Apr 09, 2025",NBC,https://www.nbcnews.com/politics/2026-election/con-man-vs-anti-trump-years-republican-fighting-fuel-nasty-senate-prim-rcna200479
20.03.25,"Trump suddenly pauses global tariff plan after days of economic and market turmoil
President Donald Trump said Wednesday that he is pausing his tariffs plan for 90 days on 75 trading partners who did not retaliate in the hours after it went into effect.
Apr 09, 2025",NBC,https://www.nbcnews.com/business/economy/trump-tariffs-president-announces-90-day-pause-what-to-know-rcna200463
20.03.25,"Bipartisan senators introduce bill to give Trump new powers to stop Chinese investment
A bipartisan team of freshman senators who went through some of 2024’s biggest battleground races are introducing a bill Wednesday to give President Donald Trump’s administration the power to stop investments from Chinese companies in the U.S.
Apr 09, 2025",NBC,https://www.nbcnews.com/politics/congress/bipartisan-senators-introduce-bill-give-trump-new-powers-stop-chinese-rcna200443
20.03.25,"China is matching Trump tariff for tariff. It has other ways it can strike back, too.
The trade war between Washington and Beijing took a turn Wednesday when China imposed an additional 50% tariff on U.S. imports, upping it to 84%.
Apr 09, 2025",NBC,https://www.nbcnews.com/news/world/china-matching-trump-tariff-tariff-ways-can-strike-back-rcna200359
20.03.25,"How Trump changed his mind on tariffs
Trump and officials in his administration were fielding calls from worried allies, and his advisers presented him with worrying data on the bond markets.
Apr 09, 2025",NBC,https://www.nbcnews.com/politics/donald-trump/trump-changed-mind-tariffs-rcna200414
19.03.25,Appeals court rules Trump administration can fire thousands of probationary federal workers,The New York Post,https://nypost.com/2025/04/09/us-news/appeals-court-rules-trump-administration-can-fire-thousands-of-probationary-federal-workers/
19.03.25,US Steel shares tumble after Trump speaks out on possible sale to Japanese owner,The New York Post,https://nypost.com/2025/04/09/business/trump-sends-us-steel-shares-shares-tumbling-with-shocking-comment/
19.03.25,NYC shoppers stock up as Trump's tariffs loom: 'Pray to God that we all survive',The New York Post,https://nypost.com/2025/04/09/us-news/nyc-shoppers-are-starting-to-stock-up-as-trumps-tariffs-start-to-bite-pray-to-god-that-we-all-survive/
19.03.25,NY still 'on notice' to end congestion pricing this month -- but it's unclear what Trump admin will do if MTA blows deadline,The New York Post,https://nypost.com/2025/04/09/us-news/ny-still-on-notice-to-end-congestion-pricing-this-month-but-its-unclear-what-trump-admin-will-do-if-mta-blows-deadline/
19.03.25,Donald Trump | Today's latest from Al Jazeera,Al Jazeera,https://www.aljazeera.com/tag/donald-trump/
19.03.25,Trump: Palestinians could live in redeveloped Gaza 'freedom zone ...,Al Jazeera,https://www.aljazeera.com/video/newsfeed/2025/4/7/trump-palestinians-could-live-in-redeveloped-gaza-freedom
19.03.25,Soya beans: China and EU's secret weapon against Trump's tariff ...,Al Jazeera,https://www.aljazeera.com/news/2025/4/9/soybeans-china-and-eus-secret-weapon-against-trumps-tariff-wars
19.03.25,Profile: Donald Trump | Elections News | Al Jazeera,Al Jazeera,https://www.aljazeera.com/news/2017/2/21/profile-donald-trump
19.03.25,Trump's tariff war: What's at stake for China's economy? | Donald ...,Al Jazeera,https://www.aljazeera.com/news/2025/4/9/trumps-tariff-war-whats-at-stake-for-chinas-economy
19.03.25,"Penguins, vaccines: Can negotiations save Trump's oddest tariff ...",Al Jazeera,https://www.aljazeera.com/news/2025/4/8/penguins-vaccines-can-negotiations-save-trumps-oddest-tariff-targets
19.03.25,"Under Trump, US Justice Department ends cryptocurrency ...",Al Jazeera,https://www.aljazeera.com/news/2025/4/8/under-trump-us-justice-department-ends-cryptocurrency-investigations
19.03.25,Tens of thousands march in anti-Trump protests across the US ...,Al Jazeera,https://www.aljazeera.com/video/newsfeed/2025/4/6/tens-of-thousands-march-in-anti-trump-protests-across-the-us
19.03.25,Over 50 countries seek US trade talks after tariffs: Trump officials ...,Al Jazeera,https://www.aljazeera.com/news/2025/4/6/over-50-countries-seek-us-trade-talks-after-tariffs-trump-officials
19.03.25,Musk vs Navarro: Is the Trump team divided on tariffs? | Donald ...,Al Jazeera,https://www.aljazeera.com/news/2025/4/7/musk-vs-navarro-is-the-trump-team-divided-on-tariffs
19.03.25,"ASL stream of Donald Trump's presidential inauguration

Watch CBS News Copyright ©2025 CBS Interactive Inc. All rights reserved.

JAN 20, 2025",CBS News,https://www.cbsnews.com/live/cbsnews-3/?intcid=CNM-00-10abd1h
19.03.25,"Trump tariffs are ""negotiating strategy,"" Treasury chief Bessent says

The sweeping tariffs President Trump announced last week were a ""negotiating strategy,"" Treasury Secretary Scott Bessent suggested Wednesday as the president announced a 90-day pause on most of those

11H AGO",CBS News,https://www.cbsnews.com/colorado/news/trump-tariffs-negotiating-strategy-treasury-secretary-scott-bessent-pause/?intcid=CNM-00-10abd1h
19.03.25,"Trump offers rare praise for Michigan Gov. Whitmer after White House meeting

Michigan Gov. Gretchen Whitmer, a potential 2028 White House candidate, stood awkwardly in the Oval Office as President Donald Trump signed executive orders and assailed his political opponents on Wed

3H AGO",CBS News,https://www.cbsnews.com/detroit/news/trump-praises-michigan-gov-whitmer-after-white-house-meeting/?intcid=CNM-00-10abd1h
19.03.25,"House GOP holdouts resist Trump pressure on budget plan, delaying vote

Washington — House Speaker Mike Johnson delayed a vote on a Republican budget plan, lacking enough GOP support to get it over the finish line on Wednesday. Several House Republicans have resisted incr

7H AGO",CBS News,https://www.cbsnews.com/news/trump-presses-house-gop-to-back-budget-plan/?intcid=CNM-00-10abd1h
19.03.25,"H.R. McMaster receives accidental call from President Trump

Just over a month ago, retired Lt. Gen. H.R. McMaster received an unexpected call on his personal cell, four sources told CBS News. It was from the White House and he was instructed by the voice on th

8H AGO",CBS News,https://www.cbsnews.com/news/h-r-mcmaster-trump-accidental-call/?intcid=CNM-00-10abd1h
19.03.25,"See the full list of reciprocal tariffs by country from Trump's chart

A global trade war is brewing as the U.S. imposes tariffs on a growing list of countries, heightening concerns about economic growth and roiling stock markets around the world. President Trump on Apri

13H AGO",CBS News,https://www.cbsnews.com/news/trump-reciprocal-tariffs-liberation-day-list/?intcid=CNM-00-10abd1h
19.03.25,"What Trump has said about tariffs as stock market reacts

President Trump has vehemently defended the sweeping tariffs unveiled by his administration on what he dubbed ""Liberation Day"" last week, even as they threaten to spark a global trade war and have sen

12H AGO",CBS News,https://www.cbsnews.com/news/what-trump-has-said-tariffs-stock-market/?intcid=CNM-00-10abd1h
19.03.25,"Michigan Gov. Gretchen Whitmer to meet today with President Trump

Michigan Gov. Gretchen Whitmer will visit the White House on Wednesday to meet with President Trump. Whitmer, a member of the Democratic Party currently serving her second term as governor, met with M

16H AGO",CBS News,https://www.cbsnews.com/detroit/news/gretchen-whitmer-trump-meeting/?intcid=CNM-00-10abd1h
19.03.25,"How much could Trump's tariffs hike the price of your wine and whisky?

London — Producers and importers of alcoholic beverages say President Trump's so-called ""Liberation Day"" tariffs will hit many American drinkers right in the wallet, with price hikes on some favored t

19H AGO",CBS News,https://www.cbsnews.com/pittsburgh/news/trump-tariffs-europe-wine-scotch-whisky-higher-prices-american-consumer/?intcid=CNM-00-10abd1h
19.03.25,"Trump's would-be assassin sought weapon to shoot down his plane, DOJ says

Federal prosecutors say Ryan Routh, the man accused of trying to assassinate President Trump as he golfed last September during the 2024 campaign, also attempted to acquire an anti-aircraft weapon to

23H AGO",CBS News,https://www.cbsnews.com/miami/news/trump-ryan-routh-assassin-weapon-plane/?intcid=CNM-00-10abd1h
19.03.25,"President Trump's New York fraud debt tops $500 million

President Trump's debt to New York from a civil fraud judgment passed $500 million on Tuesday, as interest continues to accrue while he appeals. The figure has been growing ever since a lengthy civil

APR 8, 2025",CBS News,https://www.cbsnews.com/newyork/news/donald-trump-new-york-fraud-debt-500-million/?intcid=CNM-00-10abd1h
19.03.25,"Stock market soars after Trump announces pause latest tariffs

The stock market exploded higher on Wednesday to one of their best days in history after President Trump said he would place a 90-day pause on his ""reciprocal tariffs,"" adding that he would lower that

7H AGO",CBS News,https://www.cbsnews.com/colorado/news/stock-market-today-dow-jones-china-tariffs-trump-04-09-25/?intcid=CNM-00-10abd1h
19.03.25,"Trump orders probes of two former officials who defied him
President Trump directed federal agencies to revoke the security clearances and review the activities of Christopher Krebs and Miles Taylor.
Apr 09, 2025",NBC,https://www.nbcnews.com/politics/national-security/trump-orders-probes-two-former-officials-defied-rcna200523
19.03.25,"Experts, critics raise questions after Trump says 'this is a great time to buy' before pausing tariffs
In the wake of President Donald Trump’s announcement Wednesday afternoon that he was pausing country-by-country tariffs by 90 days, some experts — as well as critics of Trump and social media users — are raising questions about a statement he posted earlier in the day that may have indicated the massive sell-off in stocks in recent days was coming to an end.
Apr 09, 2025",NBC,https://www.nbcnews.com/business/markets/trump-tariff-pause-experts-question-timing-trump-social-media-posts-rcna200526
19.03.25,"'Con man' vs. 'anti-Trump': Years of Republican fighting fuel a nasty Senate primary in Texas
Texas Attorney General Ken Paxton’s attempt to topple Republican Sen.
Apr 09, 2025",NBC,https://www.nbcnews.com/politics/2026-election/con-man-vs-anti-trump-years-republican-fighting-fuel-nasty-senate-prim-rcna200479
19.03.25,"Trump suddenly pauses global tariff plan after days of economic and market turmoil
President Donald Trump said Wednesday that he is pausing his tariffs plan for 90 days on 75 trading partners who did not retaliate in the hours after it went into effect.
Apr 09, 2025",NBC,https://www.nbcnews.com/business/economy/trump-tariffs-president-announces-90-day-pause-what-to-know-rcna200463
19.03.25,"Bipartisan senators introduce bill to give Trump new powers to stop Chinese investment
A bipartisan team of freshman senators who went through some of 2024’s biggest battleground races are introducing a bill Wednesday to give President Donald Trump’s administration the power to stop investments from Chinese companies in the U.S.
Apr 09, 2025",NBC,https://www.nbcnews.com/politics/congress/bipartisan-senators-introduce-bill-give-trump-new-powers-stop-chinese-rcna200443
19.03.25,"China is matching Trump tariff for tariff. It has other ways it can strike back, too.
The trade war between Washington and Beijing took a turn Wednesday when China imposed an additional 50% tariff on U.S. imports, upping it to 84%.
Apr 09, 2025",NBC,https://www.nbcnews.com/news/world/china-matching-trump-tariff-tariff-ways-can-strike-back-rcna200359
19.03.25,"How Trump changed his mind on tariffs
Trump and officials in his administration were fielding calls from worried allies, and his advisers presented him with worrying data on the bond markets.
Apr 09, 2025",NBC,https://www.nbcnews.com/politics/donald-trump/trump-changed-mind-tariffs-rcna200414
18.03.25,Donald Trump,BBC,https://www.bbc.co.uk/news/topics/cp7r8vgl2lgt
18.03.25,"LIVE
. 

Global markets rebound after Trump reversal, but 125% US tariffs on China take effect",BBC,https://www.bbc.co.uk/news/live/cn4jjw30d5qt
18.03.25,Scotland's papers: Trump 'blinks' on tariffs after market turmoil,BBC,https://www.bbc.co.uk/news/articles/clyqq1ndepgo
18.03.25,'Trump blinks first' and 'Only four real fwends',BBC,https://www.bbc.co.uk/news/articles/cgjll1qz5qno
18.03.25,Why Trump is hitting China on trade - and what might happen next,BBC,https://www.bbc.co.uk/news/articles/c9qwwe9rdwlo
18.03.25,Retreat or negotiating strategy? Trump steps back from all-out trade war,BBC,https://www.bbc.co.uk/news/articles/cx255d13w13o
18.03.25,Trump's Terms Plus,NPR,https://plus.npr.org/trumpsterms
18.03.25,"President Trump has announced a hold on most tariffs, but China faces tariffs of 125%",NPR,https://www.npr.org/2025/04/09/nx-s1-5357781/president-trump-has-announced-a-hold-on-most-tariffs-but-china-faces-tariffs-of-125
18.03.25,"Trump says he will pause tariff hikes for 90 days, but not for China",NPR,https://www.npr.org/2025/04/09/nx-s1-5357645/trump-tariffs-paused
18.03.25,Trump pauses most tariffs for 90 days,NPR,https://www.npr.org/2025/04/09/nx-s1-5357454/trump-pauses-most-tariffs-for-90-days
18.03.25,Appeals court rules Trump can fire probationary federal workers once again,NPR,https://www.npr.org/2025/04/09/nx-s1-5357415/trump-federal-probationary-employees-firings
18.03.25,U.S. stocks soar in an incredible rally after Trump pauses many of his tariffs,NPR,https://www.npr.org/2025/04/09/nx-s1-5357405/stocks-tariffs-china-eu-trump-trade-war
18.03.25,Trump administration backs off Nvidia's 'H20' chip crackdown after Mar-a-Lago dinner,NPR,https://www.npr.org/2025/04/09/nx-s1-5356480/nvidia-china-ai-h20-chips-trump
18.03.25,Supreme Court lets Trump administration move forward with firing of probationary federal employees,NPR,https://www.npr.org/2025/04/09/nx-s1-5356191/scotus-on-probationary-employees
18.03.25,Trump's tariffs take effect,NPR,https://www.npr.org/2025/04/09/nx-s1-5356079/trumps-tariffs-take-effect
18.03.25,Trump's tariffs hit China the hardest,NPR,https://www.npr.org/2025/04/09/nx-s1-5355967/trumps-tariffs-hit-china-the-hardest
18.03.25,'The Economist' editor unpacks the 'biggest trade policy shock' of Trump's tariffs,NPR,https://www.npr.org/2025/04/09/nx-s1-5355907/trump-tariffs-zanny-minton-beddoes
