date,title,source,link
04.02.25,"Trump orders probes of two former officials who defied him
President Trump directed federal agencies to revoke the security clearances and review the activities of Christopher Krebs and Miles Taylor.
Apr 09, 2025",NBC,https://www.nbcnews.com/politics/national-security/trump-orders-probes-two-former-officials-defied-rcna200523
04.02.25,"Experts, critics raise questions after Trump says 'this is a great time to buy' before pausing tariffs
In the wake of President Donald Trump’s announcement Wednesday afternoon that he was pausing country-by-country tariffs by 90 days, some experts — as well as critics of Trump and social media users — are raising questions about a statement he posted earlier in the day that may have indicated the massive sell-off in stocks in recent days was coming to an end.
Apr 09, 2025",NBC,https://www.nbcnews.com/business/markets/trump-tariff-pause-experts-question-timing-trump-social-media-posts-rcna200526
04.02.25,"'Con man' vs. 'anti-Trump': Years of Republican fighting fuel a nasty Senate primary in Texas
Texas Attorney General Ken Paxton’s attempt to topple Republican Sen.
Apr 09, 2025",NBC,https://www.nbcnews.com/politics/2026-election/con-man-vs-anti-trump-years-republican-fighting-fuel-nasty-senate-prim-rcna200479
04.02.25,"Bipartisan senators introduce bill to give Trump new powers to stop Chinese investment
A bipartisan team of freshman senators who went through some of 2024’s biggest battleground races are introducing a bill Wednesday to give President Donald Trump’s administration the power to stop investments from Chinese companies in the U.S.
Apr 09, 2025",NBC,https://www.nbcnews.com/politics/congress/bipartisan-senators-introduce-bill-give-trump-new-powers-stop-chinese-rcna200443
04.02.25,"China is matching Trump tariff for tariff. It has other ways it can strike back, too.
The trade war between Washington and Beijing took a turn Wednesday when China imposed an additional 50% tariff on U.S. imports, upping it to 84%.
Apr 09, 2025",NBC,https://www.nbcnews.com/news/world/china-matching-trump-tariff-tariff-ways-can-strike-back-rcna200359
04.02.25,"Trump suddenly pauses global tariff plan after days of economic and market turmoil
President Donald Trump said Wednesday that he is pausing his tariffs plan for 90 days on 75 trading partners who did not retaliate in the hours after it went into effect.
Apr 09, 2025",NBC,https://www.nbcnews.com/business/economy/trump-tariffs-president-announces-90-day-pause-what-to-know-rcna200463
04.02.25,"How Trump changed his mind on tariffs
Trump and officials in his administration were fielding calls from worried allies, and his advisers presented him with worrying data on the bond markets.
Apr 09, 2025",NBC,https://www.nbcnews.com/politics/donald-trump/trump-changed-mind-tariffs-rcna200414
04.02.25,"A 'disaster': Gretchen Whitmer's talk on tariffs and meeting with Trump anger fellow Democrats
Gretchen Whitmer became governor after promising to “fix the damn roads” in Michigan.
Apr 09, 2025",NBC,https://www.nbcnews.com/politics/elections/disaster-gretchen-whitmers-talk-tariffs-meeting-trump-anger-fellow-dem-rcna200530
04.02.25,"House votes to rein in federal judges amid Trump's attacks on the courts
House Republicans passed a bill aiming to curb district court judges' ability to issue nationwide injunctions, which have stymied Trump's agenda.
Apr 09, 2025",NBC,https://www.nbcnews.com/politics/congress/house-votes-rein-federal-judges-trumps-attacks-courts-rcna200396
04.02.25,"Trump's tariff turnaround: From the Politics Desk
In today’s edition, we dive into President Donald Trump’s sudden decision to pause many of his new tariffs.
Apr 09, 2025",NBC,https://www.nbcnews.com/politics/politics-news/trumps-tariff-turnaround-politics-desk-rcna200524
04.02.25,"Trump tariffs live updates: Stocks surge after 90-day pause announced for most countries
President Donald Trump announced a 90-day pause on all tariffs except for those against China, which he said would now rise to 125%.
Apr 10, 2025",NBC,https://www.nbcnews.com/politics/trump-administration/live-blog/trump-administration-live-updates-global-tariffs-china-rcna200557
04.02.25,"Trump voters are prepared to trust him on tariffs — but there are signs of cracks in the coalition
As President Donald Trump’s sweeping tariff plans sent stocks tumbling and economists warning of a broader economic slowdown, many of Trump’s supporters say they support the move as part of a broader vision for the U.S. economy, even if prices rise.
Apr 09, 2025",NBC,https://www.nbcnews.com/politics/trump-administration/trump-voters-are-prepared-trust-tariffs-are-signs-cracks-coalition-rcna200095
04.02.25,Trump's Terms Plus,NPR,https://plus.npr.org/trumpsterms
04.02.25,TRUMP TARGETING INDIVIDUALS,NPR,https://www.npr.org/2025/04/10/nx-s1-5358427/trump-targeting-individuals
04.02.25,President Trump blinks on tariffs,NPR,https://www.npr.org/2025/04/10/nx-s1-5357879/president-trump-blinks-on-tariffs
04.02.25,Universities push back against Trump's cuts on federal funding,NPR,https://www.npr.org/2025/04/10/nx-s1-5357619/universities-push-back-against-trumps-cuts-on-federal-funding
04.02.25,World markets continue to react to Trump's tariffs,NPR,https://www.npr.org/2025/04/10/nx-s1-5357477/world-markets-continue-to-react-to-trumps-tariffs
04.02.25,Teachers feel watched under Trump's 'End-DEI' push in education,NPR,https://www.npr.org/2025/04/10/nx-s1-5349474/teachers-feel-watched-under-trumps-end-dei-push-in-education
04.02.25,"Trump's 90-day pause on tariffs. And, how free speech in public schools has changed",NPR,https://www.npr.org/2025/04/10/g-s1-59335/up-first-newsletter-tariff-pause-trump-chris-krebs-miles-taylor
04.02.25,"Asia markets soar, after President Trump pauses global tariffs",NPR,https://www.npr.org/2025/04/10/g-s1-59319/asia-markets-soar-tariff-pause
04.02.25,"Trump Pauses Tariffs, Businesses Welcome Relief, Trump Targets Former Officials",NPR,https://www.npr.org/2025/04/10/1243870149/up-first-tariff-pause-business-relief-trump-former-officials-04-10-2025
04.02.25,"President Trump has announced a hold on most tariffs, but China faces tariffs of 125%",NPR,https://www.npr.org/2025/04/09/nx-s1-5357781/president-trump-has-announced-a-hold-on-most-tariffs-but-china-faces-tariffs-of-125
04.02.25,"Trump says he will pause tariff hikes for 90 days, but not for China",NPR,https://www.npr.org/2025/04/09/nx-s1-5357645/trump-tariffs-paused
04.02.25,Trump pauses most tariffs for 90 days,NPR,https://www.npr.org/2025/04/09/nx-s1-5357454/trump-pauses-most-tariffs-for-90-days
04.02.25,"ASL stream of Donald Trump's presidential inauguration

Watch CBS News Copyright ©2025 CBS Interactive Inc. All rights reserved.

JAN 20, 2025",CBS News,https://www.cbsnews.com/live/cbsnews-3/?intcid=CNM-00-10abd1h
04.02.25,"Trump tariffs are ""negotiating strategy,"" Treasury chief Bessent says

The sweeping tariffs President Trump announced last week were a ""negotiating strategy,"" Treasury Secretary Scott Bessent suggested Wednesday as the president announced a 90-day pause on most of those

15H AGO",CBS News,https://www.cbsnews.com/colorado/news/trump-tariffs-negotiating-strategy-treasury-secretary-scott-bessent-pause/?intcid=CNM-00-10abd1h
04.02.25,"Trump offers rare praise for Michigan Gov. Whitmer after White House meeting

Michigan Gov. Gretchen Whitmer, a potential 2028 White House candidate, stood awkwardly in the Oval Office as President Donald Trump signed executive orders and assailed his political opponents on Wed

6H AGO",CBS News,https://www.cbsnews.com/detroit/news/trump-praises-michigan-gov-whitmer-after-white-house-meeting/?intcid=CNM-00-10abd1h
04.02.25,"House GOP holdouts resist Trump pressure on budget plan, delaying vote

Washington — House Speaker Mike Johnson delayed a vote on a Republican budget plan, lacking enough GOP support to get it over the finish line on Wednesday. Several House Republicans have resisted incr

11H AGO",CBS News,https://www.cbsnews.com/news/trump-presses-house-gop-to-back-budget-plan/?intcid=CNM-00-10abd1h
04.02.25,"H.R. McMaster receives accidental call from President Trump

Just over a month ago, retired Lt. Gen. H.R. McMaster received an unexpected call on his personal cell, four sources told CBS News. It was from the White House and he was instructed by the voice on th

11H AGO",CBS News,https://www.cbsnews.com/news/h-r-mcmaster-trump-accidental-call/?intcid=CNM-00-10abd1h
04.02.25,"What Trump has said about tariffs as stock market reacts

President Trump has shaken up stock markets around the world as he announced sweeping tariffs on what he dubbed ""Liberation Day"" last week, then partially reversed course shortly after. The Trump admi

15H AGO",CBS News,https://www.cbsnews.com/news/what-trump-has-said-tariffs-stock-market/?intcid=CNM-00-10abd1h
04.02.25,"See the full list of reciprocal tariffs by country from Trump's chart

A global trade war is brewing as the U.S. imposes tariffs on a growing list of countries, heightening concerns about economic growth and roiling stock markets around the world. President Trump on Apri

16H AGO",CBS News,https://www.cbsnews.com/miami/news/trump-reciprocal-tariffs-liberation-day-list/?intcid=CNM-00-10abd1h
04.02.25,"Michigan Gov. Gretchen Whitmer to meet today with President Trump

Michigan Gov. Gretchen Whitmer will visit the White House on Wednesday to meet with President Trump. Whitmer, a member of the Democratic Party currently serving her second term as governor, met with M

20H AGO",CBS News,https://www.cbsnews.com/detroit/news/gretchen-whitmer-trump-meeting/?intcid=CNM-00-10abd1h
04.02.25,"World markets jump after Trump delays most tariff hikes, but not U.S. futures

World markets soared on Thursday, with Japan's benchmark jumping more than 9%, as investors welcomed President Trump's decision to put his sharp tariff hikes on hold for 90 days, though he excluded Ch

31M AGO",CBS News,https://www.cbsnews.com/texas/news/tariffs-world-markets-us-futures-trump-tariffs-delays/?intcid=CNM-00-10abd1h
