Judge Issues Victory for Jessica Denson In 2016 Trump Campaign NDA Case - Protect Democracy,Judge Issues Victory for Jessica Denson In 2016 Trump Campaign NDA Case  Protect Democracy,https://news.google.com/rss/articles/CBMifkFVX3lxTFBKNHpJdldFcHRyYi1iOHRnLXRiTzJCNWtiOGh3MERaanBpQTJRUTdSRko2N0pnR0hDeDZibWJPVVN6djB5Q2ZwSklaYnJnanJOSzdYTmJxVTZ0c0V1b0wtaWIyTklwSnZBZlVPWTZfdE1XZV9nSlhYT19tQ1hFUQ?oc=5&hl=en-CA&gl=CA&ceid=CA:en,"Wed, 11 Oct 2023 07:00:00 GMT","{'href': 'https://protectdemocracy.org', 'title': 'Protect Democracy'}"
"Donald Trump defends abortion position, ramps up Iowa campaign plans - Missouri Independent","Donald Trump defends abortion position, ramps up Iowa campaign plans  Missouri Independent",https://news.google.com/rss/articles/CBMisAFBVV95cUxOQmVRR2dMNmY4YWo3dFMtWnhPUzRxRkpYTklGcDhKdm5ZYk0xM2tnNDRtc29HektoVVl1SXAwREVYemJkYUVPLVZSdEtsWVk4ZXVVNlk3TFl4MFNVaF93bXl4WUVOUGVxZ0JBbVVOT19vdnpGdnFSR1Vvby1ET0ZRM21sVFVGamwtVkNVU3VrRHhSWHlSSTFacEFLOGMtUUpQenpsWjM0QVBzdXM1NUVBSA?oc=5&hl=en-CA&gl=CA&ceid=CA:en,"Thu, 21 Sep 2023 07:00:00 GMT","{'href': 'https://missouriindependent.com', 'title': 'Missouri Independent'}"
State courts to consider blocking Trump from 2024 ballot under the ‘insurrection’ clause - PBS,State courts to consider blocking Trump from 2024 ballot under the ‘insurrection’ clause  PBS,https://news.google.com/rss/articles/CBMiwgFBVV95cUxOUy0yblZjZS1fUlpIeFI2SVp1YTZ1ODIwaElrNlRBNjEwaWFKbTZKTC1uc2RYNzktLXBmZlZvamNuUm5iR1BtZlRpRmoxUjRvMWhGMENtVVhGeUtJclBCNS1rRVZ6S0RvemNnU09BTlBkYXZSLXZ5a0N1TEdfVkRFeGRScDJVTjZWUzQ4d0QyTV9kRmp6ay1YMmV3TVBJU2FJVEpUNzB1THh6YjR4S0Q0M3dPYVVRcTN0WmUwVFpUeDhJQQ?oc=5&hl=en-CA&gl=CA&ceid=CA:en,"Mon, 30 Oct 2023 07:00:00 GMT","{'href': 'https://www.pbs.org', 'title': 'PBS'}"
Could Donald Trump stand for US speaker? An expert explains - The Conversation,Could Donald Trump stand for US speaker? An expert explains  The Conversation,https://news.google.com/rss/articles/CBMimAFBVV95cUxNeDZyd2xVUWozS1JweTBlZXVDY0lKMnJyV3NiN240V3AxTEE2T2N2dXBGdk5YMHhZbEJRbV9XRjNZYnptZFhnVW1sRy1NRE5TY1JfbHVoRVRiaXAwa29lNEJwQnY0STJPTnM0amxBOHdGdTRIUm16U0kyU05tQ3k4ZjVpMEUyVWJXTXdBcEVWVGJodlZBNXZmSw?oc=5&hl=en-CA&gl=CA&ceid=CA:en,"Fri, 06 Oct 2023 07:00:00 GMT","{'href': 'https://theconversation.com', 'title': 'The Conversation'}"
Trump makes play for Michigan’s working-class voters as he skips GOP debate - CNN,Trump makes play for Michigan’s working-class voters as he skips GOP debate  CNN,https://news.google.com/rss/articles/CBMiiwFBVV95cUxPSmYwTW9IWGZRZXdLY2lXUDB1ckdZQVV1cnA3ajhWejhMMmlUaTJjWlg3bk5tSkE1MmFsLVhWNDdkdzZnREI2aHRodXUwbGZjbHRhNzl0VmZYUUo2dU11QUNKeWc2azBJRUw4aVVycFZvZkxvRlJLd0JkZFdYajljSnZ1cWJCQVpWbVJJ0gGCAUFVX3lxTE84WmRVRndJS2Y1VGFkVWgwWmFNRUlkNURERVNoSElqS1ZQT24xdUJQQjFaTnFpRTBSUGxvTDJLYlhNMXZhT1ctYzM1aEUwZDBHTzBvOEJkWGVCRDZHdGRpYTVRYVl4UU42Y1ZmMTN3WloxLXpsVGt4cEZuOS1XWTRNQUE?oc=5&hl=en-CA&gl=CA&ceid=CA:en,"Wed, 27 Sep 2023 07:00:00 GMT","{'href': 'https://www.cnn.com', 'title': 'CNN'}"
Ex-Trump attorney Jenna Ellis pleads guilty in Georgia election interference case - NPR,Ex-Trump attorney Jenna Ellis pleads guilty in Georgia election interference case  NPR,https://news.google.com/rss/articles/CBMifkFVX3lxTFBPOFhuaDhuMjBGaE11MW1kakFwa19TSU4tUTI0VkdQaEs2Q05fVlJ4Z19aR19oR3NEQXlxTmNRYTF6VE1WN2hEcm9xLTJWQlB6TldkcGNpNElnSVIwR0M4UzQ3aFdtUGJWWGJOOEJpajhGX2tLUDZ1amVBVlR3UQ?oc=5&hl=en-CA&gl=CA&ceid=CA:en,"Tue, 24 Oct 2023 07:00:00 GMT","{'href': 'https://www.npr.org', 'title': 'NPR'}"
Trump says he likes 'the concept' of a female VP pick - NBC News,Trump says he likes 'the concept' of a female VP pick  NBC News,https://news.google.com/rss/articles/CBMitwFBVV95cUxNNkJuWWNQcm1mYnRwMjJtNEZMZTQ4Q0F3alpmM21SV0w3cURqcVVUU0hOZGw3b1ltNy1zejVkQnJ3UjFuLTFNSzZHaE05c1g5RWpZRWp5VUhsaWhVc3E4SEQwa0RMQ05nTG1vbkZIcm4wRmFlRWdZYU9kZUJOX2JHbWtqUWpVNHpLTHIyMG1VVEVGVWVmbUxMOFQ5QVBMZWFmYU5IRXJfNVlid3JiOU1VYnYtenRVV2vSAVZBVV95cUxNMi16dG9SQzJ5c2ZNbjVZSW9pdHBqdS1uaEs5cUNlU3NrQUhGc0dPR1FpdkoyWEg3dlJiZTRTQUVDeWJoaU9RazNyMUdpLTJmOHJMbnJwQQ?oc=5&hl=en-CA&gl=CA&ceid=CA:en,"Sat, 16 Sep 2023 07:00:00 GMT","{'href': 'https://www.nbcnews.com', 'title': 'NBC News'}"
"Trump is 'not above the law,' prosecutors say in urging judge to let federal election case proceed - AP News","Trump is 'not above the law,' prosecutors say in urging judge to let federal election case proceed  AP News",https://news.google.com/rss/articles/CBMiqgFBVV95cUxQeGEyVkxhazRMbDg5amFPR1Z5U3djR0RUNENjV2tFX3lJOUZwdzlYdGc2dm5ZU3cyT2FfcVNYRUtyX3FGMmJmYjFrc1QyWm9PRzNVdHk5dGJjVERTTFFSRDVId203R3VYSi1wYXMxNERRdHFObndwNzEtRl9lUEt3OC1DeEplUFJFeDRCLWNRa0tmdXBmYjNxMDZKX3RHX2lzRXNEeHg3TTVDdw?oc=5&hl=en-CA&gl=CA&ceid=CA:en,"Thu, 19 Oct 2023 07:00:00 GMT","{'href': 'https://apnews.com', 'title': 'AP News'}"
Inside Trump’s Backroom Effort to Lock Up the Nomination (Published 2023) - The New York Times,Inside Trump’s Backroom Effort to Lock Up the Nomination (Published 2023)  The New York Times,https://news.google.com/rss/articles/CBMigAFBVV95cUxPdkdIbFpFT19GUThCYnQtSXFXcFVvcnRJTkRUTUZ0VHZRWFBNVVQyZC1XQWprZ1pqUUZUdWN6QTJjV2RKVlUteEFMQi00MnFuQlZyMXJaSmZKd1lqOTJFVFlUN2NLbVlfeEJweFI3SWdDa2VEQzZiSjVCdXBkNGd3YQ?oc=5&hl=en-CA&gl=CA&ceid=CA:en,"Sun, 15 Oct 2023 07:00:00 GMT","{'href': 'https://www.nytimes.com', 'title': 'The New York Times'}"
"Donald Trump committed fraud as he built his real estate empire, New York judge rules - The Guardian","Donald Trump committed fraud as he built his real estate empire, New York judge rules  The Guardian",https://news.google.com/rss/articles/CBMigAFBVV95cUxNenFMb082RFdhTDM3QU0ybDk3WXhHdFNhQzR3RjlpaDFPbEVtVm5uamdjVFNjZ2JmaElPQmtkb0RNREgwMXRWRjRLOUhTdDhnVS0yT1o1V05UN3lBN3F4SEV2YnBVWXREUHo1S2ltUEFUdGlIeEpiWTNSS1AtUWg0ZA?oc=5&hl=en-CA&gl=CA&ceid=CA:en,"Tue, 26 Sep 2023 07:00:00 GMT","{'href': 'https://www.theguardian.com', 'title': 'The Guardian'}"
Fact-checking Trump's claims about New York fraud trial - BBC,Fact-checking Trump's claims about New York fraud trial  BBC,https://news.google.com/rss/articles/CBMiSEFVX3lxTE9kVVpQejJrLW1fTUVYQW9iTjlJdTBGWEVncGJOd21zVzV6N3p5QUtwYkZCbW1NeUpoejZqbmxsaXI1Zi1ZQXEwTNIBTkFVX3lxTE95bEpFUS1TRk5PSk1QdWlDbFRjS3BOUmFsNVdMbVpPNThaRGpkRmNrOEQ2Ul90dW9iZUEyaDV5WjV3cGV6eDRvNzBIdG1iUQ?oc=5&hl=en-CA&gl=CA&ceid=CA:en,"Mon, 02 Oct 2023 07:00:00 GMT","{'href': 'https://www.bbc.com', 'title': 'BBC'}"
Interview: Rep. Jason Crow on the push to keep Donald Trump off the 2024 Colorado ballot - Colorado Public Radio,Interview: Rep. Jason Crow on the push to keep Donald Trump off the 2024 Colorado ballot  Colorado Public Radio,https://news.google.com/rss/articles/CBMingFBVV95cUxNdzFZVk9TaGFRTGtNSWVGOFE1a3hDOVg3Y1BPZ2RFaDhUWW5TZHoxZWg5MWNiTVUtSGVWbHNsQnRSQTlXOEJOemw1ejB4Ym9ZWTJzOWZtazFlMVJiOGtudmFaSVZrZGI0a1ZpZmt4WWNxeEZzWkhGcUpqMng0YlJpZDZyamo4V19hekFGN3M0dW1QWEhaaXBJTWhQbVhKQQ?oc=5&hl=en-CA&gl=CA&ceid=CA:en,"Mon, 25 Sep 2023 07:00:00 GMT","{'href': 'https://www.cpr.org', 'title': 'Colorado Public Radio'}"
"Judge rules Trump defrauded banks, insurers as he built his real estate empire - PBS","Judge rules Trump defrauded banks, insurers as he built his real estate empire  PBS",https://news.google.com/rss/articles/CBMitgFBVV95cUxPejkzRUZXVEZTelFKLW5KMzMzc0RWb0RxeElnZHFxTjZoWUF4aHNkeWxXZklQclIzRVlDV0dONjF2Z2gtSGpoRmxkc3RDZFdSc09WbDNrUTFydUVSc3M0SVhGZmNkSGxIZGhiUEtlWlVrbnMxQ2VlNTdodDN4eV9RZ19BZC1yektSSzZXdUNuNUo0RGVBNC1ITmZad1RtUXNpRFN1akdSS1ZfS1BBSk5DQUZMRGVHdw?oc=5&hl=en-CA&gl=CA&ceid=CA:en,"Tue, 26 Sep 2023 07:00:00 GMT","{'href': 'https://www.pbs.org', 'title': 'PBS'}"
Trump is forced to play by the rules in court and doesn’t like it - CNN,Trump is forced to play by the rules in court and doesn’t like it  CNN,https://news.google.com/rss/articles/CBMihwFBVV95cUxPd2hzdkRKRGFuZTltNzlQcWg3a0FHOEI4ZDc3cGpjVVBBV1BMdThrWWpzYXBhQ3hERXRESFF2ZktKTWVRcks3YVFRS01jVEJJakloRUozZzFzd0tITTI4VE84bzg1dEtDdmZMMEVEYnEtMXNSLVd5Y05ad05Rc3d5V1VkZ012eVHSAX5BVV95cUxNcUVSVUZZTEZIUUpGbURiSlZUM3NBMGtzeXBXR1h4V3hpVXVHVVR6OGVfY1Q0OE5YSEJuWWlvY1lTbnR0ODdialhKWkVFR1ZocDNOZFlmMzlfX0JZS1dOREppYmFOd2NHUEROaEhET0huVkEzYUo1UFg1ajVJTnc?oc=5&hl=en-CA&gl=CA&ceid=CA:en,"Thu, 26 Oct 2023 07:00:00 GMT","{'href': 'https://www.cnn.com', 'title': 'CNN'}"
We spoke to older voters about Trump and Biden's age. We saw 3 recurring themes - NPR,We spoke to older voters about Trump and Biden's age. We saw 3 recurring themes  NPR,https://news.google.com/rss/articles/CBMihAFBVV95cUxOT1BDTHBvNnBQUUdxRnBzS1F6cl9VejNfY1VYeHlOVW1NUkxCRGt1T2xvdlVfcVZyZENWZV8tSU5lem84VDdVcDBJdzFEZ1FUNUNsUDJvZnpYTVBGc2JreVItb3N6SlJmVVpzaE5ScEw1U0VVMHAwQ2cxMmtpYVhXN0ZDQm4?oc=5&hl=en-CA&gl=CA&ceid=CA:en,"Tue, 10 Oct 2023 07:00:00 GMT","{'href': 'https://www.npr.org', 'title': 'NPR'}"
"Trump lawyers seek dismissal of DC federal election subversion case, arguing presidential immunity - AP News","Trump lawyers seek dismissal of DC federal election subversion case, arguing presidential immunity  AP News",https://news.google.com/rss/articles/CBMiqgFBVV95cUxOVm9RWDQ3eEVCcUZTVExGYlhKODJaZ2o0Q2FvN2cxR2RGTE0wSk1LblQxSTdqd2p2SnU5QUUxTlNpOW9iM1cza1o2U21PaDc3bkZ0WmFyc1U4Xy1CbVpiUjFXODFrekJBcm9aVVhMeGppU0pHVVhuUEtBVC1pMjN5OG9sc3h5QWh2T19Fc0JadFZrMGoxYWVHTkFKLUl2MUZzbVR6WEdGaXF3UQ?oc=5&hl=en-CA&gl=CA&ceid=CA:en,"Thu, 05 Oct 2023 07:00:00 GMT","{'href': 'https://apnews.com', 'title': 'AP News'}"
Constitution Day Speaker Makes the Case for Disqualifying Trump - University of Michigan Law School,Constitution Day Speaker Makes the Case for Disqualifying Trump  University of Michigan Law School,https://news.google.com/rss/articles/CBMilgFBVV95cUxPbUlITmRnREF2VkhYeGhaY3VTYUxHWTdfVnVlYTEwaHpWQndySlk0bUhHeGZSM0xlOUlqSElqVTR6YVcwQTJTb04xNzdMQko0QlFPMnh6bXdGaUkwS3Z6N2Y3ZERTQjVZajdjZnVpamkzdTNvcTItbkctQUFBLUJrRW00bXFxd0Vhal85cUZaem05d1ZmT1E?oc=5&hl=en-CA&gl=CA&ceid=CA:en,"Fri, 22 Sep 2023 07:00:00 GMT","{'href': 'https://michigan.law.umich.edu', 'title': 'University of Michigan Law School'}"
Trump is inserting himself into the messy race to become the next House speaker. Will it matter? - AP News,Trump is inserting himself into the messy race to become the next House speaker. Will it matter?  AP News,https://news.google.com/rss/articles/CBMipAFBVV95cUxOY0VnY3NqaW9YSWktSVFsSVF3aERLYUx1aUVJMi1FRkRSMUNyQnQxWjFaMDQ4NGlNaWZWaFJyTlRocExxbUV4SFlhU18tYkl1RVNhQUpYS3ZscFpwRmZNVUdnQkZMZmtxeTg0a193S09wTV9hTUhlTXowOGc1bzgyODQ4ZlNBak8yOW5DSWYyQ2xOMU5YYTdseVFhNTltS29BS2ozNw?oc=5&hl=en-CA&gl=CA&ceid=CA:en,"Sat, 07 Oct 2023 07:00:00 GMT","{'href': 'https://apnews.com', 'title': 'AP News'}"
"Donald Trump liable for business fraud, says judge in New York civil case - BBC","Donald Trump liable for business fraud, says judge in New York civil case  BBC",https://news.google.com/rss/articles/CBMiXkFVX3lxTE1jakVhZzRiMGotVlF6OE5tSUxId3NBVVoyTjhnSlUwc2xFamhYTUJYQzUtS1FRNVZmVlFncEhOYzl2M3NyLUtibWxLcU1Fd3BMN2tmbTd5Uk45VWFEMGfSAWNBVV95cUxQMnZNU21IOGJJeFhORFhBa2VBTndyTkRjOTNlRGswck9CdVlBcHBFT3lfTVRkdS1vYkt4U0xjTXlHOFdtMFgxbzJhT1pNRGtEd0VKRWtMc0FqaVpWaUVabTI3UUE?oc=5&hl=en-CA&gl=CA&ceid=CA:en,"Wed, 27 Sep 2023 07:00:00 GMT","{'href': 'https://www.bbc.com', 'title': 'BBC'}"
Attempt to bar Donald Trump from 2024 ballot lands in New Jersey - New Jersey Monitor,Attempt to bar Donald Trump from 2024 ballot lands in New Jersey  New Jersey Monitor,https://news.google.com/rss/articles/CBMiqAFBVV95cUxNSVpvc09HN1NFQ1NlRE1rS0lBLUhhVkxXbnA0VnFrNkJleEs0dnBXdnlidXBQMWhpYWUxSkhwU245RWxoQVo5amhXYWE0cnBDeVk4UEhxM3ZETWhhbjN0VGoxRjlyVmZISHJMeWxzbkphSVlObi1CODJrV0tyNnY4LXhZNnNxQXYwMmRaNTE2U21kVXhSVGQzaXdEejRDOW9SUjU2WXg3ZTY?oc=5&hl=en-CA&gl=CA&ceid=CA:en,"Fri, 15 Sep 2023 07:00:00 GMT","{'href': 'https://newjerseymonitor.com', 'title': 'New Jersey Monitor'}"
Trump says UAW talks don't matter because EV shift will kill jobs - Reuters,Trump says UAW talks don't matter because EV shift will kill jobs  Reuters,https://news.google.com/rss/articles/CBMinAFBVV95cUxObi1uaFpDOEp1ZDllc3ZkZG9yb1RxdV90NFYwY0szU2ZRWGRUWU4zU1V4TTQ4cjZHOFN0Wjd1WjBnclZOODJmQko4VFZpWTE2VGpLX2ZVaV9CYjhfVDRPaVBKS1NXU0pLMlQ5aUF5c0traUtzMDdoYjB4Q0M0dW5kWVpDa0tZUmJUSGd0bEZlRTVGMnp1OTUxYzB0ODI?oc=5&hl=en-CA&gl=CA&ceid=CA:en,"Wed, 27 Sep 2023 07:00:00 GMT","{'href': 'https://www.reuters.com', 'title': 'Reuters'}"
Donald Trump's classified documents case gets new questions from judge and attorneys - NPR,Donald Trump's classified documents case gets new questions from judge and attorneys  NPR,https://news.google.com/rss/articles/CBMioAFBVV95cUxOT2dXOWxUMEMxN19PYkJSX0VVTDd3VzVrc05OZmtKTmtRUkhrVlE4dkdrQlZwNVJiYnlPeVM5TUVBMVZQYlV1UVJOMDYxZXVxcG5DRUtQakRybU9JN3lQSi12bGxPeVZVZUF2UkJ5TnFCMTNFNzlZRHNhV3BSS1ZTVVVfUzNINk9WeVB5QlkwZDJKZW83SWJSS1JhRzNnVDZH?oc=5&hl=en-CA&gl=CA&ceid=CA:en,"Thu, 12 Oct 2023 07:00:00 GMT","{'href': 'https://www.npr.org', 'title': 'NPR'}"
Trump won't try to move Georgia case to federal court after judge rejected similar bid by Meadows - AP News,Trump won't try to move Georgia case to federal court after judge rejected similar bid by Meadows  AP News,https://news.google.com/rss/articles/CBMiowFBVV95cUxQXzhsM3hMeS0wMFZJNTB2UDF2TXUxMDNDSjc4Nm1IQU41SElHYThfTmtWQ2ZhR25XREtSNXVSb2R4b2NKaGlUcmhJd29PV2hvc1pIbXdsNWdBV1l5dDItTXZfMG1GanpGMWx1VlRSTFA3MTZMWE1mckg0cFR5RGZiWXFlR1hUekxLNTlTbjJVQllrYmVGaEEyUmptaXBJME1WQmRj?oc=5&hl=en-CA&gl=CA&ceid=CA:en,"Thu, 28 Sep 2023 07:00:00 GMT","{'href': 'https://apnews.com', 'title': 'AP News'}"
Trump says he always had autoworkers' backs. Union leaders say his first-term record shows otherwise - AP News,Trump says he always had autoworkers' backs. Union leaders say his first-term record shows otherwise  AP News,https://news.google.com/rss/articles/CBMingFBVV95cUxOQlU2aDFpQ2E0RTZTUFVTNFlYSmRWck54VzRzcmdiclR3eFVrQWxRdmxxQlpkRDVMRGxEVUdDYnlxMGF1UEoyQ1ozTjdPdHZ0enczNFBNZ1VoR3d1QUNPZDZKcHE0NS01UWJ6VkJzU2c1UTRzMkVuTmJseXRQVnF3ZEJnUW85MHBPRHZrbUs2ZlJvMU5YLThfUkJrTUd4dw?oc=5&hl=en-CA&gl=CA&ceid=CA:en,"Mon, 25 Sep 2023 07:00:00 GMT","{'href': 'https://apnews.com', 'title': 'AP News'}"
"San Marcos forced to pay $175,000 to Wendy Davis, other Democrats after “Trump Train” incident - The Texas Tribune","San Marcos forced to pay $175,000 to Wendy Davis, other Democrats after “Trump Train” incident  The Texas Tribune",https://news.google.com/rss/articles/CBMiigFBVV95cUxNQmpzY0FRYnVUUTZSN1Q1aTREcTJDSUROdFdkb3BhRHVHMjlmMWgwbXJVYTRHY0Q1V2h5Q0E5NVk5OVJMSGFmVWNkdHpydXJNOXM3VTRCeFczaklmbUJlR3ZqdGNoNzZyOVJidk5qOXJsVnFwVzBwaWEwWXZ6TTNneUdSbkF0WUVRWVE?oc=5&hl=en-CA&gl=CA&ceid=CA:en,"Wed, 18 Oct 2023 07:00:00 GMT","{'href': 'https://www.texastribune.org', 'title': 'The Texas Tribune'}"
Judge scolds prosecutors as she delays hearing for co-defendant in Trump classified documents case - AP News,Judge scolds prosecutors as she delays hearing for co-defendant in Trump classified documents case  AP News,https://news.google.com/rss/articles/CBMimAFBVV95cUxNUUk0Nkpxb1JmOTlnNGFBaVVFaG91X2pwN2p2eWUtT0piODdMUngtSW9lcktZVVRpeG05MUFOT2VJNWpxa0pseUJfbFFtcWdHMEFaZEdrTjRxMnNjMy01R1dOb2FNdkRhMkxFLXlQMzlqR083TDBvc3M1M1lwOHZzZHhpWGNPb0ZQbjRsazNKUG9tYmU0X01UMw?oc=5&hl=en-CA&gl=CA&ceid=CA:en,"Thu, 12 Oct 2023 07:00:00 GMT","{'href': 'https://apnews.com', 'title': 'AP News'}"
"Former President Trump Addresses Supporters in West Palm Beach, Florida - C-SPAN","Former President Trump Addresses Supporters in West Palm Beach, Florida  C-SPAN",https://news.google.com/rss/articles/CBMiyAFBVV95cUxPaGVlOC01ZHVTc0tZdF9GQlJpLUNTQmxKWDFlMFNqYThkMlVsU1VwRGp3OTBfSzEydGJ2NE5MbnZWbkRwaTlqazdRV000OXJkNEl1RFMweDkxdkw1NHppRmNBekNGdVNnQ09XQ2xzbTF2bkRPdDBlZXlmV2dmR0VHRWFDbk03UVdVSmx5UzU4bHdXTkNUM0MxaUFXeU5UTUZaeVZXS0Y1Q1JFbmczZDFObmJCcU5JZGxSLWs3eW5TNG11QlIxU3lFaA?oc=5&hl=en-CA&gl=CA&ceid=CA:en,"Wed, 11 Oct 2023 07:00:00 GMT","{'href': 'https://www.c-span.org', 'title': 'C-SPAN'}"
‘I killed him': How Trump torpedoed Tom Emmer’s speaker bid - Politico,‘I killed him': How Trump torpedoed Tom Emmer’s speaker bid  Politico,https://news.google.com/rss/articles/CBMiqAFBVV95cUxPLWlCdWtfOEJ2aENEUGZHWVVPbG1VS29RMS1FOWJIVGQwbGFhRkVaVWdKNURZb0FaRGVOQkxobEpvU25JV0xJUTRKTlhrMFNkVUlBVEtPWVZlaHYzQmFMYVBxT0k5OWNTaXc4THJUMDlaRVY3Z1ZuckRrTjE1UndPTmtsZUVESExOc2M0dmFjbTNuenlsTEZLOVk5aWJ1T0lLMnRZTG5YM2I?oc=5&hl=en-CA&gl=CA&ceid=CA:en,"Tue, 24 Oct 2023 07:00:00 GMT","{'href': 'https://www.politico.com', 'title': 'Politico'}"
Trump and His Allies Are Starting To Face Accountability for Their Plot To Overturn the 2020 Presidential Election - Center for American Progress,Trump and His Allies Are Starting To Face Accountability for Their Plot To Overturn the 2020 Presidential Election  Center for American Progress,https://news.google.com/rss/articles/CBMi7AFBVV95cUxQdV9EQm8zd2o1Vng2QnlrNl8zUWgzMnQ2U2U1d1FaODZhVEc1dFFvVDNMN0gyV1hXNnlaOEVDSk1MYVNFSDdoalAwTnpwNkx6QlUyWVJvYmV4cWx4ZUQ5TDBVM2xDQ2QtTlZXSDZjbGM1WmdhZXBEaE9pY3ItNXhJYzg1Z3dYS0k0TDJjTzhQY2ZYNDIxblVzUXhpdUxWcmJwbmdlbmYxQ3VTWWt1TlpXaUZyZVp0VlFvZkR1cE5KTjVMMzlqRnExaXJZRi1nZ0N3V1YxLUphdC1xWi1rUG5MZER5cXJUaUNOZF83QQ?oc=5&hl=en-CA&gl=CA&ceid=CA:en,"Tue, 17 Oct 2023 07:00:00 GMT","{'href': 'https://www.americanprogress.org', 'title': 'Center for American Progress'}"
Trump employee and appraiser testify against him in civil fraud trial - PBS,Trump employee and appraiser testify against him in civil fraud trial  PBS,https://news.google.com/rss/articles/CBMiqwFBVV95cUxPZzFQVjVPVkNBUDhlUldfTUpfal95ZVJGZk9XaEhNMlI2cXN0Y2VxREpybEdxRjc3NlRxR2llQkx2Q09tRG4xV3hXVE03cUh0ekJYdTRUMi1FWVJneW1nNERUZlZTdzZobXhfZEFfM2FJQXMtSUJlN0RKY0VQUHhuZW04dHEwbEgtQlA4cjR4enVSMmxORFQ3S0daeFpkeVc1ZFhGRXJpU3lQOGs?oc=5&hl=en-CA&gl=CA&ceid=CA:en,"Tue, 17 Oct 2023 07:00:00 GMT","{'href': 'https://www.pbs.org', 'title': 'PBS'}"
"Fourth Trump co-defendant, Jenna Ellis, pleads guilty in Georgia subversion case - BBC","Fourth Trump co-defendant, Jenna Ellis, pleads guilty in Georgia subversion case  BBC",https://news.google.com/rss/articles/CBMiXkFVX3lxTE5WMHI4TG40RUI3eExIalJmVTIzUmpRY0k2V2NWbDNJTGl0bHRzaTRSRWJXUmJFbE94WnR2eVd2WERyRHNQQ0FLVjZ2VFN2dTFNREdkMHZPQnVuNHhNaVHSAWNBVV95cUxPLTJvWHBEUWoyYlBBa0ZlcnlFX2VfcDdWSEhFWlV1aHhUcUNMQzc0eUVuVWhhWXlUUWs0bjAxLVhBRGhIdTlaTVVkOEFGeWxiNG9IQ3dPSHhwQU5MNUJnSmNoZ28?oc=5&hl=en-CA&gl=CA&ceid=CA:en,"Tue, 24 Oct 2023 07:00:00 GMT","{'href': 'https://www.bbc.com', 'title': 'BBC'}"
Back-to-back plea deals pose grave legal threat to Donald Trump - CNN,Back-to-back plea deals pose grave legal threat to Donald Trump  CNN,https://news.google.com/rss/articles/CBMimAFBVV95cUxOZ2ZwYllQelFGci1iTTRicWp0VTlmWEpDRG1Nb2tkU3hfcDF5S3JWdDFYOVdYMXM2a3Q5dTVWOWc2QW1sOXAyQ1Z2RU40aGthYmlzVlF2RldNRUFaSTBvTGNFZE8zbU5PbGRNdVN4N2JlR09BVDFra3RZNWFfSWRkR0ExeXZXLUNiRHY1bmdYRG80V2p1OHJfcdIBjwFBVV95cUxQNjUxdndEa2tKd3N2STZNZ1FDck9ROElxZ2trY1lNZVRaWk5pMDFQYnRnbFJRYTZKbjByeGZHaEJlaHBjWE51a2NKWUNYMUtZRmtwWmNYUkFsQ3lWaElyZXJtNzkxb1IyWlYzSDVPbmk0MFhoeHZHcF84UzFsX3ZEUUZrQmtmZFV0VExpaS1paw?oc=5&hl=en-CA&gl=CA&ceid=CA:en,"Sat, 21 Oct 2023 07:00:00 GMT","{'href': 'https://www.cnn.com', 'title': 'CNN'}"
"Bankman-Fried explored paying Trump not to run for president, book excerpt says - Reuters","Bankman-Fried explored paying Trump not to run for president, book excerpt says  Reuters",https://news.google.com/rss/articles/CBMitwFBVV95cUxNVGdwVGVtcjdaek5paXFiS190OUZNemlWNnhrNDh0ZThFYm5SOWNfYlZoUkV3VzZjV3NCRUtHUDZac1lfX3RJMFBrOWl5UFpUdHZabXBCeUxFeGpwVFQxNEU1V2IzSm1BVzliVmJjRl9Ra25XMXNNdTZYTFNHU01qT21oekd4bDY0alpfMF9neHhkb3lraWpHWmJTbWdTSmo0TjhwNDZMb1g1ZlNVRGVmaTlTdGd0ZGM?oc=5&hl=en-CA&gl=CA&ceid=CA:en,"Mon, 02 Oct 2023 07:00:00 GMT","{'href': 'https://www.reuters.com', 'title': 'Reuters'}"
Trump and team stay quiet on Matt Gaetz's ouster of Kevin McCarthy - NBC News,Trump and team stay quiet on Matt Gaetz's ouster of Kevin McCarthy  NBC News,https://news.google.com/rss/articles/CBMivgFBVV95cUxNVkItU2dvMHowR25Nd1NTQ3QwWnk0ZEtEZGNReXliQ1hsQmlFWF9lOFU3Y01rZmVybGMwN0ZQWldWV1RVWXJuR0VKVHZRTnBjelZmNUdMVzFMQjNqbnBqdlpDdkcyZDVFTVIwcU5XZHc2RmdrUnpEZ0ZXWG1WU0p6S1dmZFluSjduM2RDT0djUkplMG9WMDZGQi1mV3VORVNrS2hZZ3RKei1hQ1NKa1JHaXpmcE1wcm11QVFYcmtR0gFWQVVfeXFMUDk0WlJHWVhpY3V5ZENoZXdPSVVqT2xCWGlrenhFc01sYXA5SEd1d0x5elJhWTVaRDVHNVpiM1Y3b1JxNW5mQXhmQTViRHJCWlFiQWRKOXc?oc=5&hl=en-CA&gl=CA&ceid=CA:en,"Wed, 04 Oct 2023 07:00:00 GMT","{'href': 'https://www.nbcnews.com', 'title': 'NBC News'}"
Judge Chutkan denies Trump’s request to recuse herself in federal election subversion case - AP News,Judge Chutkan denies Trump’s request to recuse herself in federal election subversion case  AP News,https://news.google.com/rss/articles/CBMiswFBVV95cUxPTG1XY0RpWm1qandpa1YxZ1htc1d0QVBZVVROazJxY1U1U3VzLXctaEk1TnBEZ0Q1TFhnaGlSQWROZlVzNzF4QnR3YkFGMkIzX3IwZXlVM2tXeHlib0dDWWFxbEpMN0FPNUNBWlV5VGQwODItcDVzODNQbXBDcmJCTkxwTDhxaUR2dmlxLWdPWGVoYXFERHNMeGpoMHNWdE9zRjZORVJ5b2hhMWI0RDBkQXNtcw?oc=5&hl=en-CA&gl=CA&ceid=CA:en,"Wed, 27 Sep 2023 07:00:00 GMT","{'href': 'https://apnews.com', 'title': 'AP News'}"
Full transcript: Read Kristen Welker's interview with Trump - NBC News,Full transcript: Read Kristen Welker's interview with Trump  NBC News,https://news.google.com/rss/articles/CBMixwFBVV95cUxPUzVqcWxleGZuamh0UjBqTzRRWmVqTXdyYllNdmp2RnhlalYwX2dxdk5XU2Z2S0owYm9kRU1KVnFrd3Y2N2Rlb1VNbVUtM2dEbWEtR3F6bmpSaEhUZG1nZDJRWUJSNnJSVUNVc2oyQjRQYmxZaHZSTXNzQVMwaVZ3TXlvLTRmcEZlS0lRd0tGVlAwLTVTbEJsby11RzJGdlBGazJfY1dHUHpENW8yRlBZTXJqVkgyZzl6UWhGSFpCZEtaT0IzdE5j?oc=5&hl=en-CA&gl=CA&ceid=CA:en,"Sun, 17 Sep 2023 07:00:00 GMT","{'href': 'https://www.nbcnews.com', 'title': 'NBC News'}"
US Sen. Mike Braun endorses Donald Trump - Indiana Capital Chronicle,US Sen. Mike Braun endorses Donald Trump  Indiana Capital Chronicle,https://news.google.com/rss/articles/CBMiiwFBVV95cUxNZHJvNWZQby1MUmRaN1Nmdk5xd2JoYUJpbXRLS2VLME1WOGR3bVNFcnBraDVIWmhVUGM5cWtTYjVGb3Q4QmxjbmJrMWppc1Fab2FwUWcxZWdBcXh3TGQwS2xwR29CYVF5aG1pVmxOLVpjWnhSdXBzZ2dqeVVPY1VqdkNwbVFUUFNmeThN?oc=5&hl=en-CA&gl=CA&ceid=CA:en,"Mon, 18 Sep 2023 07:00:00 GMT","{'href': 'https://indianacapitalchronicle.com', 'title': 'Indiana Capital Chronicle'}"
Judge issues gag order and rebukes Trump after social media post attacking his clerk - CNN,Judge issues gag order and rebukes Trump after social media post attacking his clerk  CNN,https://news.google.com/rss/articles/CBMijwFBVV95cUxQNGVNcFNnZnY5NXFTNlpKZG9vYmEtbU9mRkdYN3ZwYW5Ub1llVU1qc0RSMzh3bTBIRnpkZklvUTczdEpFZmF5Z3lSMHdtR2hsWUxCN3dpZHZ2YmxEYktoV2VyNFo2QkVpeklqVTE2U0xBZDJSa1B0YVJTanFrMl9JQkh4RWthUEZJQmk5bXdIWdIBhgFBVV95cUxONWo5YmNVVV9QSlFrRkJHWUZ0N2paWmdfM0RsZm43bWpVOVM1ZjY5NHhvZHg5OFliR0h4MWM3M0FKM2JWVkItWnIxZlc5LTB0N0JHWFZsbEk5RU9ORDFpdlFVUm5WVGo4TF9sWnpEOFBERU54ZmxKMHJrd1lBdm1BdFZEZDhxUQ?oc=5&hl=en-CA&gl=CA&ceid=CA:en,"Wed, 04 Oct 2023 07:00:00 GMT","{'href': 'https://www.cnn.com', 'title': 'CNN'}"
Biden is subject to an impeachment inquiry. Here's what's different from past cases - NPR,Biden is subject to an impeachment inquiry. Here's what's different from past cases  NPR,https://news.google.com/rss/articles/CBMihgFBVV95cUxQUThFemZkM2tLdnY5UkZMUm1NenJfand1WFdqQURrUVpDRWVjRk1ZZklLSHE1aDdpMU5mTHBGSTgxUkRST3l4Sjdjc0RKdHdKc2tDUEJRS3RFb1JJT05uTFo2ZUxVYjVnM0hUbGs2UXhCRHBGclM5Yi1aSUkwZURORVNqeGZTdw?oc=5&hl=en-CA&gl=CA&ceid=CA:en,"Mon, 18 Sep 2023 07:00:00 GMT","{'href': 'https://www.npr.org', 'title': 'NPR'}"
Trump campaign announces raising more than $45.5 million in third quarter - CNN,Trump campaign announces raising more than $45.5 million in third quarter  CNN,https://news.google.com/rss/articles/CBMilgFBVV95cUxPcUtqbDVJMXVuTEQ5SjJFLWQtb2NFU3BDVDgwS1BuZ3R0YXJ1RjFFMUU2dDY1a0JaVHdVOTZYcDl0OWk2amhnallvTDhvU1J5c1F2bkY1T3daTkNjSF9UeVVVN2FNU2xLckphMktpeVMzdHlrakxnc1ZpZ3c5RnduMi1VRDNNVlducmhnSFluOVZST0w0UlHSAYwBQVVfeXFMTW0tNnB5ZUtCQ212M1JPQV93MGFvWEhjUkxNN2JpTGZMWVRoYWUtWUhXdXdMQ2duaXR4NE8wSVphOWJ0bDd1REtFYjZHWFB0R2dXbzJrYVByYlhrOG1lX1dmVWJTUXZ4dkVtbFo1R2xUOXZHeWswWGszZlByQnJRRTAtVGthRGxiOGFJODg?oc=5&hl=en-CA&gl=CA&ceid=CA:en,"Wed, 04 Oct 2023 07:00:00 GMT","{'href': 'https://www.cnn.com', 'title': 'CNN'}"
Trump compares himself to Mandela and rails against Biden after filing for New Hampshire primary - AP News,Trump compares himself to Mandela and rails against Biden after filing for New Hampshire primary  AP News,https://news.google.com/rss/articles/CBMijwFBVV95cUxNR2FDLUpRcmJIQkhyNmlURy13RnViZHdaX2NOVDdLMExfNXhFQjZZOTFkd3h5VVFSQ1FQYlluZmJWdUxYUzhQMHQ2RXRSY3ZPZ0ZaWEllb2NEQ056ZDVUMDlyZEYyWTRUMExGYUd0cEMwWTZuamNMUWhkanBxVTJmRXZFZHdNRnVaNzhaN3FBQQ?oc=5&hl=en-CA&gl=CA&ceid=CA:en,"Mon, 23 Oct 2023 07:00:00 GMT","{'href': 'https://apnews.com', 'title': 'AP News'}"
"Rep. Scott Perry ‘central to planning of Jan. 6,’ says former Trump White House aide - WHYY","Rep. Scott Perry ‘central to planning of Jan. 6,’ says former Trump White House aide  WHYY",https://news.google.com/rss/articles/CBMidkFVX3lxTFByYXA4WXgxSVBQeFBSMWdCQmJldU5YZ2NFSmVybW9aWEhoZEQteDFTUlNFN0VFd2NOeGFsZ0RodUtrODBJTXdVZWNHY01EREp0b0Y1bDlSSVNucjJ1bDR4aFdBeHV3aWZVQkdTUDhlaC1kUU92emfSAXtBVV95cUxNTzM5amRBVDJfTlFNeXI3V3YzcFFhaEJDbjB0VVVydEVacVVYS0lnclVybjRMRm1QS2RnN0dxdW5TdS1JZmhPVVFfb0tDdFVadW5maTBrMW9EcTB0dGNzd2l1NWZac0hzeGRHMklacnF5U1d0SnlySVh2cGs?oc=5&hl=en-CA&gl=CA&ceid=CA:en,"Thu, 26 Oct 2023 07:00:00 GMT","{'href': 'https://whyy.org', 'title': 'WHYY'}"
Trump sues ex-British spy over dossier containing ‘shocking and scandalous claims’ - AP News,Trump sues ex-British spy over dossier containing ‘shocking and scandalous claims’  AP News,https://news.google.com/rss/articles/CBMipAFBVV95cUxQOTVYbjVFMzFTeTB0NlRXT0xIWmN3cDZTV241QU9wQ1BHWlVaeVpSR0tYWGotd1JpcEI0dENacDJHVU1Edjl1Rk51YUN1UXhsbWNJZ0wtaFZaX1ZYRmZ2T0NDUG9EVEY1dUo0YVpjN09SMHpIdzMxZ2x2T3ZjOTF5bHNJb01tOF9DVElYejc4T0hlZGZtcmExUS04b3FUNm5WVFZ4UQ?oc=5&hl=en-CA&gl=CA&ceid=CA:en,"Mon, 16 Oct 2023 07:00:00 GMT","{'href': 'https://apnews.com', 'title': 'AP News'}"
