Trump’s Indictment in Classified Documents Case: What Comes Next? - Boston University,Trump’s Indictment in Classified Documents Case: What Comes Next?  Boston University,https://news.google.com/rss/articles/CBMihgFBVV95cUxNMVlrNkFQT1p5aHdveVB2N3pwdE82dXJiNDZhZHBmX1hnZ0Zpc2xCYjQzOTZIZUxPYmVxbXl3bUQ4N0ZfVFE0NXc4cFcwZ1FBbnh5UWJNRV9QQ1lWRUZySVNrRmd6M1k0bEV4TDhfY2R2VkRBbEVaN2oxbFdMZHl2QjluS21MUQ?oc=5&hl=en-CA&gl=CA&ceid=CA:en,"Fri, 09 Jun 2023 07:00:00 GMT","{'href': 'https://www.bu.edu', 'title': 'Boston University'}"
The twice-impeached Trump now faces his second criminal indictment as he looks to recapture White House - CNN,The twice-impeached Trump now faces his second criminal indictment as he looks to recapture White House  CNN,https://news.google.com/rss/articles/CBMiiwFBVV95cUxPdlFWNlVKTGFVdFQ0YmswZFVOVk9SRGxycF9NbXVsb19tTkY3LXp5TU10MEk4R0NMOW93eDNTalNCa2VfUHNQdDZzb2NlZUx1ZGZEVEV4SjNuSGtzNU1qMXNoV2hkSGVtV25OTWE1OUhiUXR4NHdGSmFLY09kbm5hVWMtOWdDOUt0ay1B0gGCAUFVX3lxTE1SQjQ5a2N4eHVpa0FaQTdGOWxvdlRnaW1ZQk44Q2pkZHp1eGxQQzRSQ2xnZjlpQm1wQ2ZOYkVVVWhiSlhkdndqalNvZFlPQXNxbHE3WmtraU1MRGFyOWMyZlVVbklPWElfeGFkZzVBeGRKWWhsbnlQcFFxSzVFam4xTkE?oc=5&hl=en-CA&gl=CA&ceid=CA:en,"Fri, 09 Jun 2023 07:00:00 GMT","{'href': 'https://www.cnn.com', 'title': 'CNN'}"
"Trump charged with 37 counts in classified documents case, indictment says - CNBC","Trump charged with 37 counts in classified documents case, indictment says  CNBC",https://news.google.com/rss/articles/CBMilwFBVV95cUxQeU9fdFlnMjlXUVRodVFlcEs1bzcwT0lwWVlaT2ZmWHlndlhBc3RYWmdGdm5ZdU9zNElWUUtWMldfOE9RdmtuMlBtelU0MWpWczRaRnJlUmM4YU95b0IzVXRSNVhSM2lDVmtBYkpNUjMtajREUmpDSW5MNXlDVC1BZFkxQ0ZHWmlrMktzTkN6VGZyZGVGZ1dB0gGcAUFVX3lxTE9US2x2N3dmUG4xQmFyYk5xN3JqOUpRcjZxcUJCUlc4YWVXclk1MEVYdWs2Nk9JcUVlMFd5MkRkc2tmY3R6dFZOUmdXSTNJY0JETnEySmY2ZFRYUFlQNUV2Um01VWVFZDRMOEZHY1ZOWWZoNGVQUnpLWHI5ZWVHOGh6VjB0OFJ5bXlGYjRPczM0UjlZTGQwV3B3WUtqNg?oc=5&hl=en-CA&gl=CA&ceid=CA:en,"Fri, 09 Jun 2023 07:00:00 GMT","{'href': 'https://www.cnbc.com', 'title': 'CNBC'}"
"‘If you want to die in jail, keep talking’ – two national security law experts discuss the special treatment for Trump and offer him some advice - The Conversation","‘If you want to die in jail, keep talking’ – two national security law experts discuss the special treatment for Trump and offer him some advice  The Conversation",https://news.google.com/rss/articles/CBMihAJBVV95cUxQMEh5a3BjU2xva0JNVm92cEg4ZUdja1daV0RzMFU1NXFZX3RzM1FhZHpNWWdRenRwUDkzbXhXWGhNejItVjRyYUZ2Z0xfVThtd0lacXo0TEtJRzBva2ZfNVBKcnhiOHdwdmRjdWZhMXNNWS0zR1hVMnFHYWpyUXprRkhuUENveGpsWWlCel9SYmNJTmVYRTNJeTd5bHlXMGhiVVNMcTZIWTVHWHBPSllKd0FyVzYtZzhaRHBrTnY4dkdiN3lMemJIdklLakF0d1ppWXpERjZLbDdSZnd4djkyOGFWUXlkYnV1UG1jU1l5ejhjb25RNE1heHgxOGZtMzFoUkV4Ug?oc=5&hl=en-CA&gl=CA&ceid=CA:en,"Mon, 12 Jun 2023 07:00:00 GMT","{'href': 'https://theconversation.com', 'title': 'The Conversation'}"
Trump pledges to endorse Mark Robinson for North Carolina governor - AP News,Trump pledges to endorse Mark Robinson for North Carolina governor  AP News,https://news.google.com/rss/articles/CBMitgFBVV95cUxNbUZfbnIyeGg0emZ3V19JbUlFTFA2czMzekFvMGtqaFJCX0Rma2x2S2ZWbnBPUGlLZWNEcjFLZTUtRlZIMDZzaEdTZW8zWm1YQUlCTnQteVN2ZDBjTTB4WFJvR3BXclRSWjIwaEpaUTAwRzBhbEZWY2pkZEhlWEdzSTVnMGtwSjVhSkE2ZkxpRy1vR3dKZ3B4azBvQ3lmYXVpcEg5OGItejhTQUxBVTdlZ01SeVBVdw?oc=5&hl=en-CA&gl=CA&ceid=CA:en,"Sat, 10 Jun 2023 07:00:00 GMT","{'href': 'https://apnews.com', 'title': 'AP News'}"
In the Records: A Trump Political Appointee’s Involvement in the Durham Investigation - American Oversight,In the Records: A Trump Political Appointee’s Involvement in the Durham Investigation  American Oversight,https://news.google.com/rss/articles/CBMitAFBVV95cUxPY2ZCTGFHM29pbFVKV3JTcHBJdnRBQkczWkJOUC1LdVlpVGFHUFVOU3U5M1ZaYzExOUhPSHc3MUVVbVJ3LVBVZjNWUEhvX0Y0Q0IxRk5MTXZCeFJQWlVwU0s3SVY0RlQzM3h4ZlJDdVVVVTFyRDRkMm5KdUp6T3pxMnNETmprYU9sT2FscFRPeW0zRFRHOUVYV1BJX0JzQXkwLTVac0hGd1d0cThUbDhHTVJIcmc?oc=5&hl=en-CA&gl=CA&ceid=CA:en,"Wed, 21 Jun 2023 07:00:00 GMT","{'href': 'https://americanoversight.org', 'title': 'American Oversight'}"
"Boxes in the bathroom, boxes on stage: Pictures from Trump charges - BBC","Boxes in the bathroom, boxes on stage: Pictures from Trump charges  BBC",https://news.google.com/rss/articles/CBMiXkFVX3lxTFAyWHhEVkVQRl9rQmxpWWoxLVhSY2FJdXM2WFlSNGh0dGNSZ0VQSTg0Z2hRbDdFSFBhU2o4NHp0YngyX0o3T3duRlEydlc2TUhURHFDZnoyZ0tWUHIxVVHSAWNBVV95cUxOVkhSTG9TeG1jSXBhTHBWS0cxUzJ0V3d6ODJHWTdRUXg2dmpmbjh2MFJ4M2xFa3lFYTFYd0gyb2tTLVp2VHFmV1FhbXZEcVJQbnpScjVjREU1TEwxZGJNX3VRU2s?oc=5&hl=en-CA&gl=CA&ceid=CA:en,"Fri, 09 Jun 2023 07:00:00 GMT","{'href': 'https://www.bbc.com', 'title': 'BBC'}"
Trump aide Walt Nauta indicted in classified documents case - CNN,Trump aide Walt Nauta indicted in classified documents case  CNN,https://news.google.com/rss/articles/CBMiggFBVV95cUxObUptQ3VEV1NkWEFOSGdVTDkzS0tpQTRlSWdXSUJkM1ZSUWhzRzVvdUxxR0pjSXRFdWUwSDExT3NwQ3R3YU5oaUFFS1F4c285MUs4TTR5b0ZRZUxDLU9HbFF3M2hUdU5VX2d5QXNDV2dmNENmQU5IbXpyS3IyYi0xcE5n0gF4QVVfeXFMTmR3U01iUWhZNnU3akR4OWt6YlZBOHppVkN6LUQ4VU9ZX0pBQm5WanQ3aC1KNFNtSkFVYXVtV0JLbE9KaVNzZGFfcmR3Sl9pTl9IdkE0c0JqeUR5ZUxSOEJyOG9FWjFRNW1MTGc0T0djbTNCNnlZYVJu?oc=5&hl=en-CA&gl=CA&ceid=CA:en,"Fri, 09 Jun 2023 07:00:00 GMT","{'href': 'https://www.cnn.com', 'title': 'CNN'}"
"As Legal Fees Mount, Trump Steers Donations Into PAC That Has Covered Them (Published 2023) - The New York Times","As Legal Fees Mount, Trump Steers Donations Into PAC That Has Covered Them (Published 2023)  The New York Times",https://news.google.com/rss/articles/CBMihAFBVV95cUxOaU1rcmNMVEpaZFhpSEVFMVByUEpaaEZvbWhnUW9mVXhfNC1aY21OekF4V1JrVS0temNMUW9WV2xKOVAwRWVUcFdOZTVmdzZ5YnFCR0NZVElXSEZDZFlFeWwtMmlVQkt4VnpYY2JuM1lSOGljSFpCbTRYWVNlZTJiYTVQOEE?oc=5&hl=en-CA&gl=CA&ceid=CA:en,"Sun, 25 Jun 2023 07:00:00 GMT","{'href': 'https://www.nytimes.com', 'title': 'The New York Times'}"
Biden kept Trump's tariffs on Chinese imports. This is who pays the price - NPR,Biden kept Trump's tariffs on Chinese imports. This is who pays the price  NPR,https://news.google.com/rss/articles/CBMidkFVX3lxTE5CZjhEU255OTdXUUNkZmtnUUw1LVVUVXlvVEVraUpKeHNLWHYzSUY0RFBHWlAtS1dtUFlza19ELU5zS0poVld1bHM1eGdJbGZqeDJLM25Vc1VldGVtN25iSHk2MDlhWFlPaWpWV2JGQ1dSTWUtTEE?oc=5&hl=en-CA&gl=CA&ceid=CA:en,"Tue, 27 Jun 2023 07:00:00 GMT","{'href': 'https://www.npr.org', 'title': 'NPR'}"
Trump is not a spy. Why is he charged under the Espionage Act? - CNN,Trump is not a spy. Why is he charged under the Espionage Act?  CNN,https://news.google.com/rss/articles/CBMiiwFBVV95cUxOSFZiVzVkZTRIc2R3ZjVtZkRZRmZTUFVZZS1GOEZuSVFHNWdodUZ2VEd2dENiNFd4THVudmNDUXhJcnpyVVQzRkN6amxiMEJablVLTTgwYzZwd1hDU1EzTHlIMFVYSldpMHdDQ2t0UTBUUm1LX3dHUmRtODVSbC1qa05feDhQU0JJWjE00gGCAUFVX3lxTE44VG1RSk1reEhQX284NHFCcG9RM0xBYzFHMW1CbGZrUXA2UkZxZkE4MjZZMmtjdm03cXdOSE5NdTZlT19YWTRNUFlkbUE3SmxlZjV3LXVaWmN2eFF3OFM4T3VSSUVYNFhzcGNYTEotQjlfQ3ZXQWdWWlB1ekphaTZoekE?oc=5&hl=en-CA&gl=CA&ceid=CA:en,"Tue, 13 Jun 2023 07:00:00 GMT","{'href': 'https://www.cnn.com', 'title': 'CNN'}"
Trump’s latest indictment: what do the charges mean and what’s next? - The Guardian,Trump’s latest indictment: what do the charges mean and what’s next?  The Guardian,https://news.google.com/rss/articles/CBMiugFBVV95cUxPcjFKZnhDdzRhLU1Da254WlQxMXU0Q3BOaTZtUU00UU1uVGFQQWZycDFacFp4Mk5uTV9qTUZoYlZnVEJrLVkxb19pWElkUG1KTzRaOHAwTm5YTWJMY0RIUTRaSjZFNTRYVGdka3lkdWxNcE9PZ2ozYmx1MDQwTG5HNEFrMHMtQ3g3WEJrbXN1eWprMUVjZjJ6QXk4UVhWdXdyUmp5TGtZZU5QTlRjRkR0TmdfY3QyX1JKMUE?oc=5&hl=en-CA&gl=CA&ceid=CA:en,"Fri, 09 Jun 2023 07:00:00 GMT","{'href': 'https://www.theguardian.com', 'title': 'The Guardian'}"
"CBS News Poll: After Trump indictment, most see security risk, but Republicans see politics - CBS News","CBS News Poll: After Trump indictment, most see security risk, but Republicans see politics  CBS News",https://news.google.com/rss/articles/CBMikwFBVV95cUxOb2pEaDFsWmtIQnNtNGM3VVRfMHRURjZEcmFiTVZLUlAxSV9hYlFaZGhvSUozN2lhbFAtTmZ6N2hqM2RsRmRVdkc0bXVCcUZFLXF4N2N4cWlyQlI5U1Fnbm1WaFBJVDV1WFZhQThzRGpYMk95SjNJa01hd3hFRFpqUWR4cllhdEk0emhIUGlaOUg5MG_SAZgBQVVfeXFMTzVoT0JXaGo2X1FRYS04VXpPVHpjM1hLT2EzaGdINzE1NGtIZHo0dFlpaVFKNFNnMXdIREJXc2hKODhwMGdXZThRU2ZvWjZQaW5vMVVBdzBabjdXOW4zdHRrekY0dE5iejhfcjFXQ3pRamFTLUNLWUJIeTJSeTNodTNwNEthT0pfQ0FrNEJVOEpybmxxRUM1Zng?oc=5&hl=en-CA&gl=CA&ceid=CA:en,"Sun, 11 Jun 2023 07:00:00 GMT","{'href': 'https://www.cbsnews.com', 'title': 'CBS News'}"
"How Christie and Trump’s Friendship Flourished, Then Deteriorated (Published 2023) - The New York Times","How Christie and Trump’s Friendship Flourished, Then Deteriorated (Published 2023)  The New York Times",https://news.google.com/rss/articles/CBMigwFBVV95cUxPc3ZoLWR6Tl9ITmRjQVJTYndGMmtmRUVXa1kxTWZvUkhydEFCMGNYVld0dlBDaHVaY0lHdUlocmNWcUFzNlpIRS1LSlE2Q1NsWVo0N09oVkpvYzBTQXh1UTZJcEktUUF1X2d5c0NPWVpTSzVlRzB5NGZvcHRsMFZyby04QQ?oc=5&hl=en-CA&gl=CA&ceid=CA:en,"Tue, 06 Jun 2023 07:00:00 GMT","{'href': 'https://www.nytimes.com', 'title': 'The New York Times'}"
Trump-era special counsel defends his report on Russia probe against Democrats' jabs - NPR,Trump-era special counsel defends his report on Russia probe against Democrats' jabs  NPR,https://news.google.com/rss/articles/CBMimgFBVV95cUxOY0JKU2xUXzNnNU9tXzR1d3hZeGNrTE5zRW5UN3FlcnZ4aWZOeGl3VWM3RW5vWDZvbDhoMXg1MldLY1YzWlozVzF0MVVsMWVOb1NXT19GUDUwbXdXdkVTMndQOXlvUlVkTHpLSjBjUTBtM0tRd2NScFN3MXEwWTYwY2NoNnZ1OGZ1cnBPSzhHdWowZjlBdVJqRzVR?oc=5&hl=en-CA&gl=CA&ceid=CA:en,"Wed, 21 Jun 2023 07:00:00 GMT","{'href': 'https://www.npr.org', 'title': 'NPR'}"
Exclusive: Donald Trump admits on tape he didn’t declassify ‘secret information’ - CNN,Exclusive: Donald Trump admits on tape he didn’t declassify ‘secret information’  CNN,https://news.google.com/rss/articles/CBMingFBVV95cUxQWmthTm0wYjBSUG1wM2JSc1ZhRXYycWowOWN0cDBrSG9mMTVxU3liVEZCbEhhN3ZFZ0pYS21SWlBvNEl5S0Z6X1hoQmlNYXl2UWUxYW9HdTNMV2ZqS2FWSnNsU1N1RG9xdVRjM3VBa0dRYWt2MUN6aC1xa3NNZWhqeDNWaHR5SDRGTWhHdzRWWGxXMVIxRzZycjZzOERud9IBlAFBVV95cUxPR3lZdlExaXRCX2RqQjkzcm15SGFqOGRrcGNoUjY3TW9kTFZ6SV9sSm5RNDdoSkk2MjFZTHY3Y3JVWDlSR1JDOW4zTjRoaVc4R1IxMmItVmQ4b3N0SmVoUi1aOFVMdjNyTDJmUmVGTFRvMVkwVk9iejYzVEM0LVZyOWJ5aXBtby1ESVBVTy1rZVFvT3Vm?oc=5&hl=en-CA&gl=CA&ceid=CA:en,"Fri, 09 Jun 2023 07:00:00 GMT","{'href': 'https://www.cnn.com', 'title': 'CNN'}"
Trump says Putin is ‘somewhat weakened’ by aborted mutiny - The Guardian,Trump says Putin is ‘somewhat weakened’ by aborted mutiny  The Guardian,https://news.google.com/rss/articles/CBMikgFBVV95cUxORERvY1FRckJadXBxTF90czNfVFc1dEVaWDhaY0RrZ0E2WnA3R2RoZWttaGJPZlVrOUlIcmFSbVc1b1lwdGptZ2xmQjNndk9QTElzMXVoNjBNODBZTjNlTGNSSUNhYzA3SVN1cUQwQ1BIM0VjZ0txRmZVdDg5TXpQZHJUbm1UNDdoRS1OSlNQczZJdw?oc=5&hl=en-CA&gl=CA&ceid=CA:en,"Thu, 29 Jun 2023 07:00:00 GMT","{'href': 'https://www.theguardian.com', 'title': 'The Guardian'}"
Trump was recorded saying he knew he had a classified document. (Published 2023) - The New York Times,Trump was recorded saying he knew he had a classified document. (Published 2023)  The New York Times,https://news.google.com/rss/articles/CBMinAFBVV95cUxPdnRhYVJhTXR6d3MzTXluTVY4LXlkTXozcjlmUEhMNDEzaE9aYWp3TkV0ZmtWbEtEcllmOXQ2QjlGMDl1SElCYnV2d1ZXMDRueHpIam9lVUdKZjEzWHVMZGp6VjlEREVDZ3lDYm9DbFdHb3Rqc1pVUGV4TDJoeWZVYjhYcmVGZnBQNEUyZWVDMmRGa3B1NTJhOGJJTGs?oc=5&hl=en-CA&gl=CA&ceid=CA:en,"Fri, 09 Jun 2023 07:00:00 GMT","{'href': 'https://www.nytimes.com', 'title': 'The New York Times'}"
What might the Espionage Act mean for Donald Trump? - Reuters,What might the Espionage Act mean for Donald Trump?  Reuters,https://news.google.com/rss/articles/CBMinwFBVV95cUxONDM2dXhGMkotbGZPam9HbXhoUGhxeWVHaGY1RGJlZlF6VU96TENrQmdEdDdWdFF2dVBwYU5oUzF2aHg0TnY0bXNUUmwyTU42NHVoTENRV3pfSnJEU0pXNGR4eEZsdWNMSXAzZTBlTmd4Z19xWmplRkdTZU5rQlZCNlRrbDd2enFobnZ1a19lNk1HZDgwSy1NVjU1a3l2RHM?oc=5&hl=en-CA&gl=CA&ceid=CA:en,"Tue, 13 Jun 2023 07:00:00 GMT","{'href': 'https://www.reuters.com', 'title': 'Reuters'}"
Trump: I’ll Make Feds Pass Test on Constitution to Keep Their Jobs - Government Executive,Trump: I’ll Make Feds Pass Test on Constitution to Keep Their Jobs  Government Executive,https://news.google.com/rss/articles/CBMirAFBVV95cUxQNG9vU0pBVjltendjWHBKdUhuWXFhOGxEWVlzSWJnTUJ1UFlFSUFjeThibFBydnJFaHBRRkJGUENDTHdwVnl6ZkFyR21rbHhjdjJnZDZMb09YUFVqcFp2RldRMnhCX0x4anc4UHg3MmtMbHBwR180TWFuMkd4LXRlNHBqUDUydEs0YUNlbndzOXNiY2xCUEtXOWswWjNFYXp5Q1NzS3otR2RKdGJI?oc=5&hl=en-CA&gl=CA&ceid=CA:en,"Mon, 12 Jun 2023 07:00:00 GMT","{'href': 'https://www.govexec.com', 'title': 'Government Executive'}"
Trump faces difficult odds in documents case - Reuters,Trump faces difficult odds in documents case  Reuters,https://news.google.com/rss/articles/CBMiqAFBVV95cUxNQnRYUTFoTzdMVjlrV25vV3VzOGFSOHFnWTNZaDRWNExaUDhiMTk1OGtGRGVNU080VHRUODhJZVhDMFRZNlktbGZUTkV4ZE41UFFTMkV0MWNzRF92cFBjdHFGT2tPa0gwNmhjemF0bHRpV3NNZ3JPTlFSRnRKa1F1WjhnOU82ZFJoX2tmcGtBRFBkcEZyRTBSMWoyTkx5UjdPMXoyZExNMlY?oc=5&hl=en-CA&gl=CA&ceid=CA:en,"Tue, 13 Jun 2023 07:00:00 GMT","{'href': 'https://www.reuters.com', 'title': 'Reuters'}"
Trump Supporters’ Violent Rhetoric in His Defense Disturbs Experts (Published 2023) - The New York Times,Trump Supporters’ Violent Rhetoric in His Defense Disturbs Experts (Published 2023)  The New York Times,https://news.google.com/rss/articles/CBMijAFBVV95cUxOSXN2OU9PV2Uyc3ktWU9RZDNkZlBKMWZfSVlGUkJiOW5wUW5YczBOWXVJWmpJeXQxSWxWOHpMblJTbzJOLXZndWR0UzJ5SE5TODAtQU1YSlkzUVNFWW4yTVdvWVl3QXI4eFEtS19icGpJMWpJQ2xIeU9xaFFXalJtRnc3MGVVc3ZuXzdSYw?oc=5&hl=en-CA&gl=CA&ceid=CA:en,"Wed, 14 Jun 2023 07:00:00 GMT","{'href': 'https://www.nytimes.com', 'title': 'The New York Times'}"
How much prison time could Trump face? Past cases brought steep punishment for document hoarders - AP News,How much prison time could Trump face? Past cases brought steep punishment for document hoarders  AP News,https://news.google.com/rss/articles/CBMiqwFBVV95cUxOWXJERGRZTUdzWGFjaHVSVjdHZ3RyN1FKZmxNRjJua2Q2RjVwX1RkZUdmR0pVOFg4TzB3SGFVX2Z3Mm1STHlJZ1duQmFfNG94N2llVjRnM2xKUlJzYXJ0ZW1uM1JZTTRfRjJ4MUNXSTFDaHJXRE1rRzRVaGwwQm9wdjhISE5CcHFCLVJiYktSMTc0Z1ZLa25xYWRjUTVwRVhQT25DWTJWM21aTlU?oc=5&hl=en-CA&gl=CA&ceid=CA:en,"Thu, 15 Jun 2023 07:00:00 GMT","{'href': 'https://apnews.com', 'title': 'AP News'}"
Audio Undercuts Trump’s Assertion He Did Not Have Classified Document (Published 2023) - The New York Times,Audio Undercuts Trump’s Assertion He Did Not Have Classified Document (Published 2023)  The New York Times,https://news.google.com/rss/articles/CBMihAFBVV95cUxQMEZTWmptSnc0Ukl1cERoRHRIcUVPQ3ZYYkZfS3JlbHNfc2pXWjN6VGZnY185OGlDUEhJYnZpNVYxbFh6bk9ZR19wck43MFVJZ1h6M25PMDYtSUJyYm4wNkpWS3dvb21sMFBoQTMxQ0d0aU1GZm9DU0dqaVpkS095eXRUVzY?oc=5&hl=en-CA&gl=CA&ceid=CA:en,"Mon, 26 Jun 2023 07:00:00 GMT","{'href': 'https://www.nytimes.com', 'title': 'The New York Times'}"
Ivanka Trump dismissed from New York attorney general’s fraud lawsuit against her father - AP News,Ivanka Trump dismissed from New York attorney general’s fraud lawsuit against her father  AP News,https://news.google.com/rss/articles/CBMijgFBVV95cUxNNDYxcUhZY0ZTYUhoTktxRWNTUGZKcm5XcS11NXpVa2lTMlhCeE91QlFmM0FOa3Ayb3BBV1J0LWZ5LWR2dGQzMlV3UVpfa3RmR2ZvdW1KNC1nVDM5RUxJSGN4U2FUTzlCX2pHQW53cVg3LXpWM1hrNjYtUGZpelJqd3dOZGJzZHJfTkRBdDJB?oc=5&hl=en-CA&gl=CA&ceid=CA:en,"Tue, 27 Jun 2023 07:00:00 GMT","{'href': 'https://apnews.com', 'title': 'AP News'}"
Rep. Clay Higgins posts cryptic Tweet after Trump indictment - Louisiana Illuminator,Rep. Clay Higgins posts cryptic Tweet after Trump indictment  Louisiana Illuminator,https://news.google.com/rss/articles/CBMingFBVV95cUxPRG1uN1liMlZzNU1sZjRwcjFTQUY1WklUUHM5TGh3ckctT2dzb3V4U2JPTTgwSlVlX2M2UmtndDFfYXlLaVBycnBGWG5qcWhDTTB1ZVkxZWlnOEtJVXhYUGlYTWQ1MjFYQ1NQZDd4T1dENGxKSnRORG5yRzVzajMzc21vYXZMemJ0Z1VmY2VrTlZyNm9DZzc4MkVNWk1uUQ?oc=5&hl=en-CA&gl=CA&ceid=CA:en,"Fri, 09 Jun 2023 07:00:00 GMT","{'href': 'https://lailluminator.com', 'title': 'Louisiana Illuminator'}"
Hear exclusive audio of Trump discussing classified documents in 2021 - CNN,Hear exclusive audio of Trump discussing classified documents in 2021  CNN,https://news.google.com/rss/articles/CBMimAFBVV95cUxNSjhqOUFZQ0xWaFdzSDJQeVBlRHllWHJjNS1TN1pHNG1JbUlEUjhDZDVYUjlGN0MwMXVLeTZwOUhwWFN5Nm04ODhMUEhrbWFnUFJZQkhIaURDR3JjYzg1NkNDazhhS2JRZWxZSkFuLW4xcUNMd2ZjbS1yMU1wLWZndmZkQ0xibEV6T2l1SWp4Ty1FaUNHRFpZeQ?oc=5&hl=en-CA&gl=CA&ceid=CA:en,"Mon, 26 Jun 2023 07:00:00 GMT","{'href': 'https://www.cnn.com', 'title': 'CNN'}"
What we know about the document Trump mentioned in the taped Bedminster meeting - CNN,What we know about the document Trump mentioned in the taped Bedminster meeting  CNN,https://news.google.com/rss/articles/CBMiggFBVV95cUxQSzVXYWJGZ1d3czMwcHhyMkZTazBaeXZLSUs1SU9HN3BfNjAxMTBTQjRfeEFKaGFjQ2RGaUw3eUxNYzA0NXVvN28wMGdOdG5OV09MUVhOMWg0UTI2VmhEalloOHdYNVNHUUxOY1FVSjB0dF9xV052SmszaHVrYWxnNFRB0gF4QVVfeXFMUHlzSDZfLWtoYnFHbGVrci11T25OZ2hlSDlOZjJXV3BlUTE1bmV4S0JFa3FfV21XLWx5cWh3TnBJazktU0VlNl9mU1Q0ZTA1OTBudWZvYkY5MlV6cHV3Z3ptV0FtcEhyUDhqOXZqSXRaMFZzVEMyMkVG?oc=5&hl=en-CA&gl=CA&ceid=CA:en,"Wed, 28 Jun 2023 07:00:00 GMT","{'href': 'https://www.cnn.com', 'title': 'CNN'}"
What the Trump Indictment tells us about the State of American Democracy - iris-france.org,What the Trump Indictment tells us about the State of American Democracy  iris-france.org,https://news.google.com/rss/articles/CBMisAFBVV95cUxQOG9lR2V4UzJOcGFqa3lMam43bjVpSkV1SlNLZDc1eDZrT203M1dSV2N1dlh1TTBKUmkwR2ZJVTl5NFg0bTVwTkp2eWU1ZkZ4d1I1WHFVYjY1Vlk0aEt1RUltbGdoMDgycW1OQmkwcFEyajh1OGpDNGpQM2xFUXlaYzIxZnVNODl3dWpNSU9YOUpxUkF2dzZIbUk4M3AwcFAwaG4tQWlzR3hCRkdjNFl3cQ?oc=5&hl=en-CA&gl=CA&ceid=CA:en,"Wed, 14 Jun 2023 07:00:00 GMT","{'href': 'https://www.iris-france.org', 'title': 'iris-france.org'}"
"Where Does Trump’s Case Fall against Past Presidential Scandals Involving Sex, Power, Profit? - Boston University","Where Does Trump’s Case Fall against Past Presidential Scandals Involving Sex, Power, Profit?  Boston University",https://news.google.com/rss/articles/CBMieEFVX3lxTE9fX2RZaTNuLTR5aFhKRzlsanpxTGhlRHQ0NE5FNFNiNTdpLTRoTUFvaDVFRXNOV0RhYlhfcDVnU3JydkNuX2JZZkl2TVQ5VGNwalFlTU1YX0xfcnd1UFRwWkJ6M3pRUXBmQW9vQUcxN2szX2dyRkJKcg?oc=5&hl=en-CA&gl=CA&ceid=CA:en,"Tue, 13 Jun 2023 07:00:00 GMT","{'href': 'https://www.bu.edu', 'title': 'Boston University'}"
Detailed Timeline of Trump Hush Money-2016 Election Investigation - Just Security,Detailed Timeline of Trump Hush Money-2016 Election Investigation  Just Security,https://news.google.com/rss/articles/CBMidkFVX3lxTFBlOXU3eWxEQ2s3cUpKc0x2aWJKd3FjeFhmZGthRHNySk5fWTRmcjJpLW1wU0F6RG1RQm1sb3ZSd3E0WHQydWlOUEF4X19tU2taWUhRZUhLMzd5NWtTcUN6TDE4bzNORVRwNmwyaGtvSUFyR3JRR1E?oc=5&hl=en-CA&gl=CA&ceid=CA:en,"Wed, 24 May 2023 07:00:00 GMT","{'href': 'https://www.justsecurity.org', 'title': 'Just Security'}"
Top Trump campaign aide Susie Wiles met numerous times with special counsel investigators in documents probe - CNN,Top Trump campaign aide Susie Wiles met numerous times with special counsel investigators in documents probe  CNN,https://news.google.com/rss/articles/CBMirAFBVV95cUxOSFlIbGxUdUdrM0E4el90ODY2VGZmbVVMSnBSY0N5aEhmVWpLTE5odE1HWWJLR2E2ZW45bEpVYXBNb0tqTXktOEVRdkF6MEVOcFZZRlctVjVYWG51dloycEtzTnZKZVcwMWFhcGtnU1RXc0ZCOHdXNy1rMWtRT05YNmI1YmRaNE1HQ2ZRSmFPNEVmcGUxOF9vRlJOSHlyWHZKRWQtc2JYSm1XTkxN0gGjAUFVX3lxTE4wTkxxVEdnMG5TTTEwRFVYSmFyUUF3WTJuTWZvY2F1bk14bzFaNHlvckUtVk5GMWVmSms4SE1NMzRGMU9hVE5VR1c5NUViOWJ1RUNFRV9CN0Q1YWRHWVBIc0dvVzJmbHBrZVppRDJTd215RTF5bS1pcXZoUWdaY21zYnhHRHhRT2E2LWd1dWR2T1hCUEJyZGJiVHlWYTBUMFF6dkU?oc=5&hl=en-CA&gl=CA&ceid=CA:en,"Thu, 29 Jun 2023 07:00:00 GMT","{'href': 'https://www.cnn.com', 'title': 'CNN'}"
Trump indicted for efforts to overturn 2020 election and block transfer of power - AP News,Trump indicted for efforts to overturn 2020 election and block transfer of power  AP News,https://news.google.com/rss/articles/CBMirwFBVV95cUxQYTJQQS1TM3I4Zlk2MWhfd1ZCVklRN1djYjh6WGxEQVl6dm1BbjdUd2lCLS1SVGlyTEphaFJ0T0lteWcyd1dKMHpWU0U0NTJSNUI1WUpzWWdkRmphck1TS0hUaVFiZzdQSjhBelBWU0RNR2UtTV9OUk1mSWh6YzhYVjJlNWVVdUg5NkVMSUpXVTRIb3lmVXNVVHBmRDJxSEdqck1JN29IeDR4N0toWUxF?oc=5&hl=en-CA&gl=CA&ceid=CA:en,"Wed, 02 Aug 2023 07:00:00 GMT","{'href': 'https://apnews.com', 'title': 'AP News'}"
New charges linking Trump more closely to coverup effort could deepen his legal woes - PBS,New charges linking Trump more closely to coverup effort could deepen his legal woes  PBS,https://news.google.com/rss/articles/CBMivwFBVV95cUxNcEtTTl9EN3pNYlZBSmhoZ21oMUdicmQ1Uy1ueFk0M0U3SGdGbWFtTzNoaDdMdUViRVVUc05IUWVWSnJseFVnOV9sTUIySnh0eElWc0ozSm1pRlVoTUVKbXd5SW4zY0dhRTVmM1NROEVDajB3Q1VBNHFLVEpBallQZjcxN0lSUlpHblpOTzg2cnVJVGFwR2NyNnJNM2NZVzRsTXg2bkRIUzBrOEZIYTlZWTBaeGdRekJWT1I0NTk1bw?oc=5&hl=en-CA&gl=CA&ceid=CA:en,"Sat, 29 Jul 2023 07:00:00 GMT","{'href': 'https://www.pbs.org', 'title': 'PBS'}"
Donald Trump has been booked at the Atlanta jail on Georgia election charges - NPR,Donald Trump has been booked at the Atlanta jail on Georgia election charges  NPR,https://news.google.com/rss/articles/CBMiekFVX3lxTFBOX1Jjbnk1NzY1VnE0djJ4bGk1TzAwQjVTdVk4VEFBYkxHNWZJZXRkNHh3a2FUN0dLeVRBQ3QyblVGbjR2dWx2T0U5WHA2dTJtYXpmYURYMjZHUFhqN2JCNHE1NVdUUC10eU5KMFFoX2xEZ2VGLTdhN3ln?oc=5&hl=en-CA&gl=CA&ceid=CA:en,"Mon, 21 Aug 2023 07:00:00 GMT","{'href': 'https://www.npr.org', 'title': 'NPR'}"
Did Trump really believe he had won? - Harvard Gazette,Did Trump really believe he had won?  Harvard Gazette,https://news.google.com/rss/articles/CBMiiwFBVV95cUxNSHJONmloSWNFaG5nZzV0UUREQW5LQUNGREtCWUNDeVVkdG04ZFREc3UwLTRLbHVIZ05GeFBXX3NIcS1EUUpyaV9zRVN1YTZxLWJCdnM2NkxiVGw5bGRrRmRza05SSlFzRzYxQWp4M0N0SnpPUFJoYXhmV0lwMzFCOU9QSVhydjlveWZB?oc=5&hl=en-CA&gl=CA&ceid=CA:en,"Mon, 07 Aug 2023 07:00:00 GMT","{'href': 'https://news.harvard.edu', 'title': 'Harvard Gazette'}"
"Middle East Visits to the United States Under Biden, Trump, and Obama - The Washington Institute","Middle East Visits to the United States Under Biden, Trump, and Obama  The Washington Institute",https://news.google.com/rss/articles/CBMisgFBVV95cUxPcng4SzhTdFlQdGxScjhMbGZmeHk4UFhmc0lUWlk5N25XSnhxeWFndU5sclFJdUZFZHVNUnhvT1NDNmRZNG5wRHdRZEZJa2tMaWp4cV9vSm53ZmZWcnJaTFZ0QldkU20wYUNCMldaWEZJd2JxT3E3dXpNYXVtTHg0dkFQdzBUT0g3VjBNdGppSUhvakpIcXlqc09XOWt4TzNkLTJyZDM2ZklfQlJaWnNkZ3dR?oc=5&hl=en-CA&gl=CA&ceid=CA:en,"Thu, 20 Jul 2023 07:00:00 GMT","{'href': 'https://www.washingtoninstitute.org', 'title': 'The Washington Institute'}"
Trump’s $300 Billion Tax Hike Would Threaten U.S. Businesses and Consumers - Tax Foundation,Trump’s $300 Billion Tax Hike Would Threaten U.S. Businesses and Consumers  Tax Foundation,https://news.google.com/rss/articles/CBMib0FVX3lxTE5lRmtVVzBLbXdDNlNQT2FzVER2VXVfZHY2VmF6SnlVbGxDT3FzQlFwdlRHUFU2MEJsN2IwV0FmSmJoU1E0RnlMR3hEOEVxQU9uN2c1MGlvYy1aLUxER1pxb0dSd0MxcnZUVjItNU9OWQ?oc=5&hl=en-CA&gl=CA&ceid=CA:en,"Fri, 25 Aug 2023 07:00:00 GMT","{'href': 'https://taxfoundation.org', 'title': 'Tax Foundation'}"
Why Trump's poll lead went up after criminal indictments - BBC,Why Trump's poll lead went up after criminal indictments  BBC,https://news.google.com/rss/articles/CBMiXkFVX3lxTFA2Q3NBVFBHT1pQNEZmenFrcjBSSmhMRFA1aVlIcDNnRS05U3dfLWNNSGdWdkt2SmpYQzFpWDB5MUtiOEpXcFJyb0hqdURlNnJmRjRMNTZYWjBtekZlckHSAWNBVV95cUxPMUtfbS1Nb0kzZVlFaU5jeG9DalltdVo0N2ZRQ2JGbjJmdWppTWxTUTRSdXRIajJDQXN4X0l5X1RCcy1xOWpiV1k2a3gxSHRQMHNlODhYYWNwaEZjM25iZ3V2RzQ?oc=5&hl=en-CA&gl=CA&ceid=CA:en,"Tue, 01 Aug 2023 07:00:00 GMT","{'href': 'https://www.bbc.com', 'title': 'BBC'}"
"What do Trump indictments mean for election, democracy? - University of Chicago News","What do Trump indictments mean for election, democracy?  University of Chicago News",https://news.google.com/rss/articles/CBMiiAFBVV95cUxOYmtQcFEzejNRUEEyMWtxVUd1ZGVUUjZFNUE2NlJsVXUyZHlibXNmWHZia1ZuQUc3SWpQdFZlUWdtN2Q2WTlFelUza2xYWWtYeHZ5ZUFMNTlBdWJzUkQ3anNEQ01mZVl0UW1PcG1OaHBBMjhibkJOWDdoN3hpbDNjcmxzTkF2STZE?oc=5&hl=en-CA&gl=CA&ceid=CA:en,"Tue, 15 Aug 2023 07:00:00 GMT","{'href': 'https://news.uchicago.edu', 'title': 'University of Chicago News'}"
Co-Defendants and Unindicted Co-Conspirators: What Public Records Reveal About Trump Allies’ Election Denial Activities - American Oversight,Co-Defendants and Unindicted Co-Conspirators: What Public Records Reveal About Trump Allies’ Election Denial Activities  American Oversight,https://news.google.com/rss/articles/CBMi4gFBVV95cUxNVTJaZWRzeW11S2VFVmpjWklod1UydUJJVGY5QnhkVEd4Nlp0V0tuT19GdDN1SVJ4Mk5pVWZKaDl4aXRUNzRPRkxXUGNNUHN5eHRfbGZVNm9ZWHZMYVN1YmVuV2NqQjNsaE4xaXllNmlBN0VTY0xZRFYwNlFLWk1NSzZnVncza3lCcXczOHlVOER5Y1Y1TTM5dERza3NNX3JGRjFxVUVGb2ljZlFlWGVYckluM0NkSTVnYko4dWNJeE02S3dyZGRuWVROV2gwZkJxYVJ1MDFiUVpfcXp5T1NzSEJn?oc=5&hl=en-CA&gl=CA&ceid=CA:en,"Mon, 28 Aug 2023 07:00:00 GMT","{'href': 'https://americanoversight.org', 'title': 'American Oversight'}"
The Civil Rights Law Used to Indict Trump - Brennan Center for Justice,The Civil Rights Law Used to Indict Trump  Brennan Center for Justice,https://news.google.com/rss/articles/CBMioAFBVV95cUxPU3h4akEtVnBJell5ckRkdERYelA1TF9jWWVHV0pyd0hMR1NjcFBFNXptZkdnT2pZdTRFNHN4T2VfY0pqWTZJbFE4Y3E3aXNUb0I1eERucTVUelVYa1dmWDlSMGxLYURjMjM0akFlNkxKSVBSTXlnVHNSNXZoVnJqZTNqWldvQUJnbFJ1VEJmR3BKQXRJUDlVamkyWWsxN09w?oc=5&hl=en-CA&gl=CA&ceid=CA:en,"Wed, 26 Jul 2023 07:00:00 GMT","{'href': 'https://www.brennancenter.org', 'title': 'Brennan Center for Justice'}"
Trump has surrendered for a fourth time this year. Here's where all the cases against him stand - AP News,Trump has surrendered for a fourth time this year. Here's where all the cases against him stand  AP News,https://news.google.com/rss/articles/CBMiowFBVV95cUxOT2x2X1hleFotTFdpalJRT1VZcVZRX0ZtSUhCclZqbGlybjgwS1UzSW5IcG1Sa1Q4TlBjOHRFYXNCUGlERzNoelpNNEZwY2VlRV9TSXZmQnM0ejRIZ2d1Q0Y2NGJMcGk4cm9XeFBtQmRGbmhnY3JXUVdpNFhlX3lIam1UUFY4eWd4cU5QZU5VeEpnd1VvY3N3dUFHVW5VenB2TUk0?oc=5&hl=en-CA&gl=CA&ceid=CA:en,"Tue, 01 Aug 2023 21:54:53 GMT","{'href': 'https://apnews.com', 'title': 'AP News'}"
