Trump’s Abuse of Recount Funds Shows the Need for Clear Regulations - Campaign Legal Center,Trump’s Abuse of Recount Funds Shows the Need for Clear Regulations  Campaign Legal Center,https://news.google.com/rss/articles/CBMikgFBVV95cUxOSUhVbXVnendLSHRWRmpWR3ZZLW9RSzd6YWhjdlNTdnVmeEZVNHN5ZnNwS0FGMjJud1RDVVdOUzdZVGJVc2sxdmVpVGdITUVnLW1DWVhzOE4ydU14MzloWl9TeHZMNElHdXdhVVh3a01wU0pXYV9FZzNRQ2hkLVg3YzVCc3hDNEJnbTBFdzNUZXRnUQ?oc=5&hl=en-CA&gl=CA&ceid=CA:en,"Tue, 31 Jan 2023 08:00:00 GMT","{'href': 'https://campaignlegal.org', 'title': 'Campaign Legal Center'}"
Trump criticizes federal response to Ohio train derailment - AP News,Trump criticizes federal response to Ohio train derailment  AP News,https://news.google.com/rss/articles/CBMiugFBVV95cUxNRjduZW1VaTNhNWdKUmF3eHlhcE9LR2hhTlRTTXB1MFpLelR5VU9VYThTSjRLRVQ3dmMzdUdsVUFyaGp5a1Fvci1ZRHBjbXhFQWM0SFUyRlZlOGJqQ1drajY3dmdZTDFIWWVKc2ZUQUhvaUhkaGxGR0hheHZwX2FKOUdjYnEyUUVyb3Vqb1EwVWk0M3lkd0NPQnlHYTh1WHhKb0dSU3BYcVRJU0hua1I1a2sxOEdZREo1U3c?oc=5&hl=en-CA&gl=CA&ceid=CA:en,"Wed, 22 Feb 2023 08:00:00 GMT","{'href': 'https://apnews.com', 'title': 'AP News'}"
Fani Willis is likely going to indict Trump soon. Here’s what that looks like: - CREW - Citizens for Responsibility and Ethics in Washington,Fani Willis is likely going to indict Trump soon. Here’s what that looks like: - CREW  Citizens for Responsibility and Ethics in Washington,https://news.google.com/rss/articles/CBMi1gFBVV95cUxOem9rbllsTEliMWNCNnhMZ19ETzhZTGRQSjVacWtzYTBLN2FoQzkzY0UyV0cyd0V3dGVKT0xRY29HU2lpdURvcF9HQTgtWDF0SS0zcmd4QmZ2ZnJKa2tKZVpSaXdyMm5wZXhsblVLanlwV0E5UGNOdmNaYUdXa1E5dEx0cDF6WXhGVC1zbW8xMHFGQ0hrN1h5dkJLQlUxNlRoTWw5aFlqTnk5Q21ZZHhxd0JSeUFGMi02ajgyRU1ENWJJYk9faS1aQnNkb2ZIeGJlZmx2anR3?oc=5&hl=en-CA&gl=CA&ceid=CA:en,"Mon, 30 Jan 2023 08:00:00 GMT","{'href': 'https://www.citizensforethics.org', 'title': 'Citizens for Responsibility and Ethics in Washington'}"
"Trump, after reported subpoena, defends keeping classified folders - Reuters","Trump, after reported subpoena, defends keeping classified folders  Reuters",https://news.google.com/rss/articles/CBMirgFBVV95cUxNMkxPaERpWWVYLTN2cU10VVkyQlVLYmFVb1lNbU9UbE1GVjZMWVlSbHh0YjJLVTBHYTBSQ0tBZlhWQXpMdzlPcjV3Y3NRTTViQnBWRS1YUkZwNWhmRlU2TDItbE90cmhjOHN3RGhVNUI2WGlwdUloYWJPdnRBZ0lQZzUxMEQwVVU5WTFYTXhVeVE0ZlRaN0tienRLWXJPcmR6ZWlOWU0yMzVBcVlSUnc?oc=5&hl=en-CA&gl=CA&ceid=CA:en,"Tue, 14 Feb 2023 08:00:00 GMT","{'href': 'https://www.reuters.com', 'title': 'Reuters'}"
Trump vows to 'stop' gender-affirming care for minors if re-elected president - NBC News,Trump vows to 'stop' gender-affirming care for minors if re-elected president  NBC News,https://news.google.com/rss/articles/CBMivwFBVV95cUxNbEU2TUtiVDlSMzVSVTJxbGpEUE8zNGRPVFZVQ0FKWjN5UVF1bjVsUVp0YlpRMU16UzlfZkxOZlVEbmhtZUx1UHVXTklOcDlacmNoMlRfTk1Obi1UN2pBQXoyZ2tiM1hWeXQ0Ql9xdjVveWV2WFdwSUhSa1ZhX1diWHZxX2Nsd1VYcl9OZ1ZZeEdOSUtsQkpub1o2STRHZ1VnTlFxVjlUMnRGLURON1ZDRUFmbFNpQV85X0NiTDhtd9IBVEFVX3lxTE1WWTR3SDRJTzZkNEdmWV9jNGh5d25kQS1UaDI5Ym9TbERsXzcwYWRWeVNOallESGgybW5hOTBWR2lBZG55MmlESW1ua3BhTjRnWS1CNg?oc=5&hl=en-CA&gl=CA&ceid=CA:en,"Tue, 31 Jan 2023 08:00:00 GMT","{'href': 'https://www.nbcnews.com', 'title': 'NBC News'}"
"In East Palestine, who 'shows up' isn't necessarily a sign of who's helping - NPR","In East Palestine, who 'shows up' isn't necessarily a sign of who's helping  NPR",https://news.google.com/rss/articles/CBMisgFBVV95cUxOczBDNkx6b3NoSjhjTW5NdlNGeUR4VjVHWkt0UWY2dmRVYndON29ZbFFKRkFzb0IzV2lZdFlzeTFpV1JMZHNMbmk4dHVQLU5wbE1OeDAxalA2bk5jYzEtaDlPbk5lLWdoa0ZoSS1PeEhSd1FSU3VTVTBKTkRtaXVRX09vOVVIejRqZEhJQlZ5MGZGSDFLMXBySU56ZkRuZ0VlQnRtYnprbUpEMGJnaEFhT2tn?oc=5&hl=en-CA&gl=CA&ceid=CA:en,"Sat, 25 Feb 2023 08:00:00 GMT","{'href': 'https://www.npr.org', 'title': 'NPR'}"
Trump sues Bob Woodward for releasing audio of their interviews - CNN,Trump sues Bob Woodward for releasing audio of their interviews  CNN,https://news.google.com/rss/articles/CBMihAFBVV95cUxPcFhPSy1uajhoa3c5X3hlakRWb0lnbnFJRWFNLVN1MHdfbU96MGNjeWFMaHJ1NGphWlpvaU5NdlplZkQ3bWZ6UWRrWXNCa05fa2JXQU9yeF9tNjdBMkJOUklCNTEtaDU5SGdGaml2c1g0blAtQUhPeFAxeGctWjVLLWJzNzPSAXtBVV95cUxPZFNESXV2bEtYejJQZGxCWEV6dXhaX1BfdDc5M2xDcVpDQ2VlbW1aLUlXNTl6dGo1TldXbG9VblNsWjNfVmQzS1Y1elAwZlgtVlZzTnZ5T0laY2ZrSUxxRUwtNU9oR1ljRW1lTUJNMWptVGUydm4tczM0T0E?oc=5&hl=en-CA&gl=CA&ceid=CA:en,"Tue, 31 Jan 2023 08:00:00 GMT","{'href': 'https://www.cnn.com', 'title': 'CNN'}"
"Trump launches 2024 run with visits to New Hampshire, South Carolina - PBS","Trump launches 2024 run with visits to New Hampshire, South Carolina  PBS",https://news.google.com/rss/articles/CBMiqAFBVV95cUxNekh6TXUyeWdCY0t2THlyc2VldVFHTlJpYm0xaURoSVFkdUdJS2paYmt5Z0xJUkJ5ZlAydnkzOGU1MTc5V3VKeXN6NDljWGRvN0h2NUVlYmlvWDlCQnNVeU1Xak42X25KMWpXeGhnd2xVVXhhSUl1UlI5d01KeXI5ekNiOUdfdUkwcDJEWkR6QjVzajlqWmFOZ3dWdms1WGV0a3BNTTg1a1E?oc=5&hl=en-CA&gl=CA&ceid=CA:en,"Sat, 28 Jan 2023 08:00:00 GMT","{'href': 'https://www.pbs.org', 'title': 'PBS'}"
"Based on Biden’s two years of judicial appointments, Trump’s four-year record seems secure - Brookings","Based on Biden’s two years of judicial appointments, Trump’s four-year record seems secure  Brookings",https://news.google.com/rss/articles/CBMiwAFBVV95cUxPVFE4dnFrQ1pWdmxjRjJ5UHBvMjNtcnRycVdWRUJHLUt5X1JDMm5rMWRiWVNQZ09jMUYyMmxFeElGVkg2RlhRR0ppd08xbVE4MXhDSk14WWJMWl9GSEJDRE1ZcjAzXzBiN0tTTmNtRXg5ZVc0azNLYnQ5V2Q3cXBZYUxUSDFEOGl2NGNFM1NRUjNYSHdiMnU3bXhKNUMwMFRxR3NxYVpxbVpwajA1dFBmLUNWMDI2QUEyYzMxVUhLbHQ?oc=5&hl=en-CA&gl=CA&ceid=CA:en,"Mon, 30 Jan 2023 08:00:00 GMT","{'href': 'https://www.brookings.edu', 'title': 'Brookings'}"
Manhattan Prosecutors Begin Presenting Trump Case to Grand Jury (Published 2023) - The New York Times,Manhattan Prosecutors Begin Presenting Trump Case to Grand Jury (Published 2023)  The New York Times,https://news.google.com/rss/articles/CBMihwFBVV95cUxNY193Zk02V1Z3Z19QSk9JcHBjeGctQnZUbnNJYTBWaWN4U3Fudl9Kd01JRGxtMW4wUl9yU24xLXIyQ2o2c2dOU3BGLVpOalVRcnd6M0M1UWpUU0ktVHpFN1JPMlJycktybEJvdUdvdkFHN2NaaTRtc1hOWkVqOW03Vmk0ZWZTR00?oc=5&hl=en-CA&gl=CA&ceid=CA:en,"Mon, 30 Jan 2023 08:00:00 GMT","{'href': 'https://www.nytimes.com', 'title': 'The New York Times'}"
"Former President Trump Visit to East Palestine, Ohio - C-SPAN","Former President Trump Visit to East Palestine, Ohio  C-SPAN",https://news.google.com/rss/articles/CBMirwFBVV95cUxNeXFicUpKRnRuMnRKR1FGaXNrS0J1OFhTcm9xbk5rRk5JNWlQV1dyWVEwNGt1Z3lJZ1cxY0VWeVJQbDY2MnFZb0lRNlpfOTI1R1lPVGdpZUdKOHhUX2F0VWFyQVFVdGMwVEltdTVwTjNvWXU4U2lBR25HNzhtSDhYb0xnc1ppWnEycGdhM2tUUTk2NmNwdTdvNWwyU2hoS0FrR2FPZ3FTLUpKUWVHamlJ?oc=5&hl=en-CA&gl=CA&ceid=CA:en,"Wed, 22 Feb 2023 08:00:00 GMT","{'href': 'https://www.c-span.org', 'title': 'C-SPAN'}"
Donald Trump back on Facebook and Instagram - BBC,Donald Trump back on Facebook and Instagram  BBC,https://news.google.com/rss/articles/CBMiV0FVX3lxTE1Wc005RmhXQlVsa3NWUlhkaEdCTDhYZTRtVnpOWTVxOFJlMUVpcWk2VXJpbmxIZFR2bXRzbXVNaVBVTDZJUFFIOGJEOEJuZU1ZZGozclNBa9IBXEFVX3lxTFB2bTc2LTFhNkNtMEZPZ003TENXTEJUemJBYW1fY0dmLUNyQkpNOXhjOEh6eVNWNWpyZGs0QlktdnVKc2lRZWszeTgtQnRtTzZSTV9SY3VIblU2MFM5?oc=5&hl=en-CA&gl=CA&ceid=CA:en,"Thu, 09 Feb 2023 08:00:00 GMT","{'href': 'https://www.bbc.com', 'title': 'BBC'}"
"In Trump probe, US seeks to pierce attorney-client privilege - AP News","In Trump probe, US seeks to pierce attorney-client privilege  AP News",https://news.google.com/rss/articles/CBMingFBVV95cUxOc1ctbWJvdXRMZGt2VTNiOF9Td3FrR2hOazJPMjQ1a2dLZXhEejFUd0wtZW9VRHlaYk1zMzlVQjdHRkR5Um9WUW9oZzgxcG9adUZtT3I0Y0Iwa284Uk9QSHZQYlZaR09VeXdnemhSZ1pkb09xb05VdEREZFdTdkZFNmZnM3JUS0lPZGg5T29lMlcyNkliS2cyVzhROUtwQQ?oc=5&hl=en-CA&gl=CA&ceid=CA:en,"Tue, 14 Feb 2023 08:00:00 GMT","{'href': 'https://apnews.com', 'title': 'AP News'}"
Trump’s tax returns confirm millions in income from Indonesian business interests - Citizens for Responsibility and Ethics in Washington,Trump’s tax returns confirm millions in income from Indonesian business interests  Citizens for Responsibility and Ethics in Washington,https://news.google.com/rss/articles/CBMi7wFBVV95cUxOaE1kX1YtdFRFQ2UxRURiTlp0WjljYlhVdHpFZkswOVhEZDZ4Y2x5X0VnNHJYZU5LZGFvc1d6d0VybVdRX2hUOC1TS0NvZ0RWQjNoQW1kZ0dtd2YzUm4xcHAzVVItY2VqWmNxNlM1a29ldk90UEZDc2dKcTQ5UUs5TmtIQjRrQ0wxQjgxck0wMmgyeDBUZ2RjWUJjMXQwZzJXUy1VcU9kRm91N040YWpOcDVhNktFVkxCZ2RRYi1CRGhKdXdfNXdBZnFkMVI1VjFBZzJYb1o0TFNaZXJhb2psY0J1ckVNOGd3NlhNZ3NYZw?oc=5&hl=en-CA&gl=CA&ceid=CA:en,"Wed, 22 Feb 2023 08:00:00 GMT","{'href': 'https://www.citizensforethics.org', 'title': 'Citizens for Responsibility and Ethics in Washington'}"
Mitt Romney: Trump is 'by far the most likely' 2024 GOP nominee - NBC News,Mitt Romney: Trump is 'by far the most likely' 2024 GOP nominee  NBC News,https://news.google.com/rss/articles/CBMipAFBVV95cUxQWkMtcGRxeG5ESmFZLWhfVG5ra3Fkd2RRdUw3OFE5c2YwcXY2ZXdaUDNOaTNQclNFbDQxYzFsSVN0THhFbzdWczJRaVJ6TV9Zc0ZUdzFsbE53VDlfYzl0bTBqb3daVW45WTI2em9YZ21JSUJJMVJBMEVONW8yNXJ3bGJnbFg3VnJrSE55N2h2VTAzektpd3BjRUtCTzQ5aldSeDhETtIBVEFVX3lxTE11b3o1TWxHdHAxeGNiSXVSZkpRVVgtQ1FFeHRSV0JjWnZEdWNlSXNWa0RIMjVkU19kT3A2Y0pnRkRCbl92WE92UHhpTTlNUUlVSE5zVg?oc=5&hl=en-CA&gl=CA&ceid=CA:en,"Thu, 16 Feb 2023 08:00:00 GMT","{'href': 'https://www.nbcnews.com', 'title': 'NBC News'}"
Trump’s fate in 2024 may rest on whether he can repeat his biggest surprise from 2016 - CNN,Trump’s fate in 2024 may rest on whether he can repeat his biggest surprise from 2016  CNN,https://news.google.com/rss/articles/CBMingFBVV95cUxOajktXzZ4bWlaSGNoX0o4UGIyMk5qQ0ZnMG01Z2FBRFljTW8wejdMbFp2aWFoUllnM3BkQXNMbVVyaV8waTNEaTdzLXlLQlZIb1lxV1oxWm1mQWVfTVBzNExRTlRqRFF4NGtxaUJRYi1yZkR5Qnh5T0xodzlaY2RiOV8yOUxpRVNLbXViYjFXMzUzZFo3ZFMtb2h3VWFiUdIBlAFBVV95cUxNaWhIV0Qtb0g2WXItWDBMaVJubkhzWFduVEtwa0h4RHpienVoY1hidzY0SFctWmpCUHJ6cU92U2hrOTlkZzloTDR4V0tfYnd4MV9JaGZQUEl1NU0tVUpKYll3WXIzMU1zUHhLVVBrb0NrZmNpU1g4Z0o3S3NxcS05ekFlOHZicDVEUndXeWk1RTkzdlJw?oc=5&hl=en-CA&gl=CA&ceid=CA:en,"Tue, 14 Feb 2023 08:00:00 GMT","{'href': 'https://www.cnn.com', 'title': 'CNN'}"
Does Conservative Mean Whatever Donald Trump Says It Means? - NPR,Does Conservative Mean Whatever Donald Trump Says It Means?  NPR,https://news.google.com/rss/articles/CBMiogFBVV95cUxOVlVhWU5pVUVUa1E1N0pCY0RzeEJuNTJsQzRlTi1zTDZ3cFc4UGxTdFhVN1VKLUN6bHBWN1BZVTAtcUIxcU9YZFdyaEFxdHdtbzZvLWgwUFZqalBnMmVJZU9wUk01MEdqY0pZLXF1VnhXQ0xEaHVuQXlROW9fcW5jQ0hQbldGN050RTlULUM4c1p6d201UEpqTE8xUkE3cUdHblE?oc=5&hl=en-CA&gl=CA&ceid=CA:en,"Fri, 27 Jan 2023 08:00:00 GMT","{'href': 'https://www.npr.org', 'title': 'NPR'}"
Trump’s Well-Worn Legal Playbook Starts to Look Frayed (Published 2023) - The New York Times,Trump’s Well-Worn Legal Playbook Starts to Look Frayed (Published 2023)  The New York Times,https://news.google.com/rss/articles/CBMie0FVX3lxTE5lcVRqYzRhODF6bXBZZlFtWEdFMUE0UWxhM1R3M096XzE1X2l6WDFlNkFZbEhFWWJpdDJnaGlFWExtV0V1by1HSzVodGZvRUdZUFhrdFdyeWZaMEJabFRiRkJUZnpyN3N1WFpOU3AzSDZlVnpBYldsUEs1aw?oc=5&hl=en-CA&gl=CA&ceid=CA:en,"Tue, 31 Jan 2023 08:00:00 GMT","{'href': 'https://www.nytimes.com', 'title': 'The New York Times'}"
Revived Trump probe puts Manhattan DA back in spotlight - AP News,Revived Trump probe puts Manhattan DA back in spotlight  AP News,https://news.google.com/rss/articles/CBMizgFBVV95cUxQamxIVHZ5M2o5UnVERzRTLVV5OVdYZVNsTUViSnQza1dZRF9qb2k2R0swVzNaSkF3UndMcTJ5NXd4M2gyREZuUnRlakVVUVc3LVdTZGt3bm05cXNEcXJCeXhNV3V6aGNYbU9aWjlGby1MN3I3dEVRX19fQlBGTUFTa3JpeGRER3NMLXZxNDIxSVdoRGV1bG1GcW9oZjZ6N1ZlR2lPajFnRjkxOFU5aDlZZUY2TXhLS0NWU3ZOTHQ4NE9KTUpPcXhfckI3RTB6QQ?oc=5&hl=en-CA&gl=CA&ceid=CA:en,"Fri, 10 Feb 2023 08:00:00 GMT","{'href': 'https://apnews.com', 'title': 'AP News'}"
"How they compare: Trump, Biden, Pence classified documents - AP News","How they compare: Trump, Biden, Pence classified documents  AP News",https://news.google.com/rss/articles/CBMi4gFBVV95cUxPQUNfNTEtU3hMd1VSLUVwLXYxY2xINWhUQUdjdnVJR0t4WFMtc3l3WFJWUFhzY3BSTllYajRJRlJ2Z3B5VFduUTc3U0Q3SjJfVkxWTHkxcl9YTG45dUJEaFNXQmtGSDU4eVN5WVQ2ODlPdGVVZExkdG9wOUtzNkhRU3o3U1AxejFjeDNRcS01Zkk1TU54Zy1vT19GaDA0bkx6VHhXd1pSUzVVaU1ZLVJlb0FWMjFDTkQ4UFZHMUNTdlJWdXNQd3lvQzdqVmQtdHJKSVdPbUlhYkVjWGNwOHBlRGJR?oc=5&hl=en-CA&gl=CA&ceid=CA:en,"Fri, 10 Feb 2023 08:00:00 GMT","{'href': 'https://apnews.com', 'title': 'AP News'}"
"Trump visits East Palestine train derailment site, calls response a ‘betrayal’ - PBS","Trump visits East Palestine train derailment site, calls response a ‘betrayal’  PBS",https://news.google.com/rss/articles/CBMiswFBVV95cUxNa0h4QlNrdGFpdTdqbGMxSTdPUk1xX0ZqbU91ZGlzZFFmYlVEdmFCT0dHXzFRbG92NXd6NEkxQ3ByVG4wbFRYVDBRNnJkTldtUWtNeTVMVkxqMS10Mkh3YXJMRHEwZTFKVlZRTk1DN2RQdlZ0V1p3UGNEckRhZFROZjVGY2czb09fbzVYRXpYSDVaVERiOEZ5MmJoZnVmdTJqWS04YzVzXzNhMTNhMkdzeDJGbw?oc=5&hl=en-CA&gl=CA&ceid=CA:en,"Wed, 22 Feb 2023 08:00:00 GMT","{'href': 'https://www.pbs.org', 'title': 'PBS'}"
Trump visits Ohio train derailment site in effort to highlight Biden’s absence - CNN,Trump visits Ohio train derailment site in effort to highlight Biden’s absence  CNN,https://news.google.com/rss/articles/CBMijAFBVV95cUxPVlk0bXV4WUtuU0tpWXBvQ1NsYU8tVTBTNmkyNk15aXl5Vjg4bGpyejlGbWdXa3I4Zll2WDNyTktrLXYzZllQeFhmT0Nwc0dTMGI2eC1LUUxZX19MbWxqWmhhOFpxVWJsNDNKSF9aRUcyV0FmTDdJNUx1YWJGRkN6dlVnWWMtX3hlLU5UMdIBgwFBVV95cUxPby1faDdvUG90UVZBWDRrdHRTUHdrdkpaeDkySF9HQUtJdS13d3ZPSkNGOUd1NkkxMlpPeUhHRFY4RGd4VC1sMUR1VHB5X0toS2lzOXlNM2RuRHg2QjBvSnhIYlE1YXhYMWEzOGVNVGxfU1ViLVlZZ1h5Q2s0emZzMHYyZw?oc=5&hl=en-CA&gl=CA&ceid=CA:en,"Wed, 22 Feb 2023 08:00:00 GMT","{'href': 'https://www.cnn.com', 'title': 'CNN'}"
Trump points fingers at the Biden administration in East Palestine visit - NBC News,Trump points fingers at the Biden administration in East Palestine visit  NBC News,https://news.google.com/rss/articles/CBMiugFBVV95cUxNaVZGWkprMExpTFotVGdoMk5YSnhIdDdxdk9SMlR2X2xrUmF1TVNiWGJUbjJUdUI3ZG9TUVk2VU9RcEpaS2dOLWRMSzhwQUc3NS16UUg4RmRLa0RrRkpLY0YzVFkxYUJ3OXNJZlJKZWZZSXpqYy1acThEWXlYck52Ynp0ZjB2WGROcWVfVkthZUFBb1ZUSGdtRmlodlZLckRZVkw3Skk2RElvRndnbU9aRTVpenoxbm1CbVHSAVRBVV95cUxNWmd5R1Y0U2pJU2xZdUV2MUIxTlR0ODB2TWk2QWxuMFJ0VnhqM1RBV2ZZdU5HLWczOURoT0lMZ0xERk5kSE5iMnR5YkR3ekw1cWJkeXA?oc=5&hl=en-CA&gl=CA&ceid=CA:en,"Wed, 22 Feb 2023 08:00:00 GMT","{'href': 'https://www.nbcnews.com', 'title': 'NBC News'}"
"Judge upholds Donald Trump contempt order, sanctions in New York civil probe - Reuters","Judge upholds Donald Trump contempt order, sanctions in New York civil probe  Reuters",https://news.google.com/rss/articles/CBMitAFBVV95cUxQLW9fLUxadGhleXp2cldsUGs4aFJqclFRM2Q0ZHFnZmpuU0tYYXZ4d1ZKOWRPUk1UcVZGR2Q5Q3J0QWNGVGVNeXdNZWpLcDdxQ0JIbU00WmphMFRqOHl3X19tdG00aWVGdExVaFgyVVRtdmhnTVRncGRtMldPUWpWR19hN2pxcU1WUTJPYzF1SHlRMkNSWWpQNXVFYW5WckloOG5oSHdsbXV3S282VjRIR2tFQ3Q?oc=5&hl=en-CA&gl=CA&ceid=CA:en,"Tue, 14 Feb 2023 08:00:00 GMT","{'href': 'https://www.reuters.com', 'title': 'Reuters'}"
Meta restores Trump’s Facebook and Instagram accounts - CNN,Meta restores Trump’s Facebook and Instagram accounts  CNN,https://news.google.com/rss/articles/CBMihwFBVV95cUxPRnkwVldVQmJLNGxBUTVOTVM1VkFJZW5QRUJPSC1FcDYzejVZRGxFS085R3BWeGk4ZmpyQlpSbkRsbmM0alJJWHBVWjlpREo2SzVRUW12TFBTUzItOG5yLXRGb1dTN3lSeWJPLWNPTGFwVk1lTEpQTEZXWllsMnpDbElkT3oxblnSAX5BVV95cUxPNlk0bTdhSzRQTDJxNFdnbHl3MGltNWVVTjR6X25kVUwyY0REZEFCRjZ5cjc3NWd3Y1Rmdk05djFIN0FDSmZRaXNZd1RySXYyMTQ4Wmpxel9ETnhSTUZvSGN5ak5jNEkwLU42Wmx0U2VVN1hHdVhxRzZQdExFc2c?oc=5&hl=en-CA&gl=CA&ceid=CA:en,"Thu, 09 Feb 2023 08:00:00 GMT","{'href': 'https://www.cnn.com', 'title': 'CNN'}"
A timeline of Nikki Haley’s past Trump statements - NBC News,A timeline of Nikki Haley’s past Trump statements  NBC News,https://news.google.com/rss/articles/CBMipwFBVV95cUxOWS0xVjlfT0I2Ykk0OTdQVEhSU1B3cHhpcmh2QzhfNWg4WmZHSGRBNWVBNTJlV0poQkl4VksweXNocms1X2p4UGFETDhMS25Yc2lmY3hpYzBQN20yX3dmZ0hUWk1WLWF0bl93X3BKMTFWbEVxdm1WZU0wTXdLdTVMZHdTRTZTS2ZiLWUybTRHbVU3U2xsZzdfc2k1LVRfdE00eWR1R0tuTdIBdEFVX3lxTFBwcjJ5X0IyQmJ0Qm8tVS0wbWtqd2ZISkJPRHNFYU53eHNKZ2o2dFp6ejltTENoTzVJM1g4Sk9rNUpmdHZOaUUzVmVRSDQ2QVI4bzlneGJiWVhDZnJ0SF9COEV4dzdnRDdJRTV1YUQwSGYyd01y?oc=5&hl=en-CA&gl=CA&ceid=CA:en,"Wed, 15 Feb 2023 08:00:00 GMT","{'href': 'https://www.nbcnews.com', 'title': 'NBC News'}"
DeSantis vs Trump Voters: Insights Into GOP Primary Divide - NPR,DeSantis vs Trump Voters: Insights Into GOP Primary Divide  NPR,https://news.google.com/rss/articles/CBMioAFBVV95cUxQYzJPNzZTWU5TenZFTDY1MlVRQ0FXbVZodHNQWGpERTRHUUpCcUNuVmFkaFlvaDFRM056d2xxRU02alRDRjhTdDF3dlZIOE1OYVZ2NVZkNkFZOUtqSDhKUURBQk9CS05jbmFuYmhRbWJmdU5GSExTcnFsNmwwYl9mUktrZml0MGlyeElQTWo2T2VuNDgtWThZQmFWSG9JRHdh?oc=5&hl=en-CA&gl=CA&ceid=CA:en,"Thu, 23 Feb 2023 08:00:00 GMT","{'href': 'https://www.npr.org', 'title': 'NPR'}"
Trump-era Chinese spy balloons went undetected - BBC,Trump-era Chinese spy balloons went undetected  BBC,https://news.google.com/rss/articles/CBMiXkFVX3lxTE9lUmh1RV8wUjF0YjVscE9JRjdfemF2R1FSWDE0UHR1dFBhV05yaEl5RUp1U2Ffc0VwT2YtMnVGcXdzeGo0OS1acXVQYWtNQWw3N2I3Y2gxWm1rMjFTbnfSAWNBVV95cUxPTVpOY3BabUVNbEVUSjV6TUI3c01mSUlIQUlhdW92R1JVdmpGUWdaV1NyeWYtbDJWbkVJcnV6ZnFZcFdITklPX0s1amtsdWp6RDNVOWs5VEhvbThZdVdkOVFNTlk?oc=5&hl=en-CA&gl=CA&ceid=CA:en,"Tue, 07 Feb 2023 08:00:00 GMT","{'href': 'https://www.bbc.com', 'title': 'BBC'}"
Trump frustrated with conservative group Turning Point USA - NBC News,Trump frustrated with conservative group Turning Point USA  NBC News,https://news.google.com/rss/articles/CBMirwFBVV95cUxPb0hzT29pV2Z0TGxFeEI2V0x0OXpOd3ZfUVFoQVFKdVlQN1ZUUVJMOEpFLTYweUZicTBPZzc2QVdXQjRFM2U0YWFtd2s4T2lteWZZdWdJdGRHcWhJQklGbExpdnRENHM3cGNtdHRHcFplUk1lNk1kRXN3NW52SUY3RTZNUzY2S3BiUUp5dTJ2VWVYbV9wMVVUXzdITl9pOGNvMGswSXV2MDFFQUdBQmtZ0gFUQVVfeXFMUG1DWjJIdTFmMXRXcmQwWVJ4b3RnenduQm5iWUtJSXE3UFdtMTM3QzM3V0x4bXM1ZW1TRjBOTVZrQ0RyYmJwWXo2RWJXNUtCYWNuWjhw?oc=5&hl=en-CA&gl=CA&ceid=CA:en,"Fri, 10 Feb 2023 08:00:00 GMT","{'href': 'https://www.nbcnews.com', 'title': 'NBC News'}"
Trump’s grip on the Republican base is slipping — even among his fans - The Washington Post,Trump’s grip on the Republican base is slipping — even among his fans  The Washington Post,https://news.google.com/rss/articles/CBMikwFBVV95cUxNLVdpOEVhSGE5Q2pJMkhwalBsYmR5MWpvZ3JCY2RYR0FMbWhEU1h1V1hzWkV5Y3FUMXVJbUNSdHUtcUYyRkJCTnowTFk4bmVMVFNNSnRkSEFLX3o2djEwOXdFbURkeXJxYXdYbVVrUmIxMmZVZnhVU2ZId2p0MGhPOU1zdEJ5bllnNDdhOGxEaUhVSms?oc=5&hl=en-CA&gl=CA&ceid=CA:en,"Thu, 23 Feb 2023 08:00:00 GMT","{'href': 'https://www.washingtonpost.com', 'title': 'The Washington Post'}"
The Pence subpoena could set up a showdown over executive privilege - NPR,The Pence subpoena could set up a showdown over executive privilege  NPR,https://news.google.com/rss/articles/CBMiiAFBVV95cUxOOUsxZmxkN1g1RFFqaXRlRG1GS3JYNFF6RkhZbF80NXJhSS1xdWxMNFg0ZnFUR0hnZUJtdVRFMTZtWUhNeTR4NWdxQW9xQnBTOUNYRE1VdlY2VmlBejRjczh5R25oNVBUS19ZQzBLck9jQjdPMGJyWlNMZTdNQ29YeERRN0hKOG9t?oc=5&hl=en-CA&gl=CA&ceid=CA:en,"Sat, 11 Feb 2023 08:00:00 GMT","{'href': 'https://www.npr.org', 'title': 'NPR'}"
Trump’s False Claim About Defense ‘Deal’ with South Korea - FactCheck.org,Trump’s False Claim About Defense ‘Deal’ with South Korea  FactCheck.org,https://news.google.com/rss/articles/CBMikwFBVV95cUxPVDRvendTRkpZcGhjNFBCNFRFZ3JBdnJ0RUFxeWVzSElkTGJaR3ZPZ19MODBVcTNJQllGaUFWU2FRNlloOS1DZDQzdnJLSlFWcDJSMmhtM3A4WlhhemZDeVB3Y3loTkR3SDdwbzdRdmc2aDVDM2VkNkhsT3laZEczbUxFaXBiLXV1YmhRN3BHYjllR2c?oc=5&hl=en-CA&gl=CA&ceid=CA:en,"Fri, 24 Feb 2023 08:00:00 GMT","{'href': 'https://www.factcheck.org', 'title': 'FactCheck.org'}"
Donald Trump Announces South Carolina Campaign Leadership Team - C-SPAN,Donald Trump Announces South Carolina Campaign Leadership Team  C-SPAN,https://news.google.com/rss/articles/CBMitAFBVV95cUxOaGQ3UkNFcWxteUQ5bUkxWGZZTGtxZ3ozempuZmsySENyc0pXQklQRHZqSDRjRFJHT2VDV1A1YWwtWWlTVFd0dWJDamFhU2ozV3BwRkVWTGgxMjhTTGV2a0RQMU50dkFzVTJVejA0d2dZdXJuUTVYQ3hoOXFxMTAxeVJhOW9VZGJGM2Nta29oVzFHTVRDS004ZEg3SENwQUdPbXBkN3d1MERWclhiQjJMWG9wN0w?oc=5&hl=en-CA&gl=CA&ceid=CA:en,"Sat, 28 Jan 2023 08:00:00 GMT","{'href': 'https://www.c-span.org', 'title': 'C-SPAN'}"
Donald Trump’s New York - Commonweal Magazine,Donald Trump’s New York  Commonweal Magazine,https://news.google.com/rss/articles/CBMiaEFVX3lxTE93M2hZNXBxMmM3aTJiN3NPLWV2V2dCT0ZHR3dSM1ZScXpRRzBLUlBra3FzWUNOTUxOWkg0anI2VW1CVzktRkp3czAxekZ6Zmh1SHZPTWllQWtKQkx3d2M0QXRHWXVWZjJo?oc=5&hl=en-CA&gl=CA&ceid=CA:en,"Mon, 20 Feb 2023 08:00:00 GMT","{'href': 'https://www.commonwealmagazine.org', 'title': 'Commonweal Magazine'}"
"These Voters Fret Biden's Age, Just Not Enough To Pick Trump - NPR","These Voters Fret Biden's Age, Just Not Enough To Pick Trump  NPR",https://news.google.com/rss/articles/CBMiogFBVV95cUxONVliVUNtcE5kelJJZlM2M01xejRtT0x3YVNkMVp5azJ0Z1Y3U1lSYWRTSXRPalF4UTR1a3dJUVY5SmFlMlRwcFZSNW9fdnVvaXhVUm9lY1BsQWE1TU5kdVA1ZVhSdUNMVnVFRjR6Vk9VdGFid0Q3V3FQVUZUZXRGYlM3QXhjU21fcV8zb1VfaEJpakZkMWpBejdnbWxuOFNtNUE?oc=5&hl=en-CA&gl=CA&ceid=CA:en,"Fri, 17 Feb 2023 08:00:00 GMT","{'href': 'https://www.npr.org', 'title': 'NPR'}"
Chinese spy balloons under Trump not discovered until after Biden took office - CNN,Chinese spy balloons under Trump not discovered until after Biden took office  CNN,https://news.google.com/rss/articles/CBMilwFBVV95cUxNYkp3Q2ZBbC1aYU9MM0NDeGw3VFNiSVVkckZHVzFwWVdXR2NWdFJkckFCcm54OHFSbUxwbmZKX2hKVHZDMkduZlNoa3IxTDRDSkNvazZqNGZFNGNRdEZIVmFrUFpNYnZuLWhZaTdjZkVQWlpDeTV5TS1ndTRNYmVMemoxcTgxU21KVDJ2b1d1MHlQUldTTGZB0gGOAUFVX3lxTE9qX01BVXhULWphMmJ6S00xenRYVVVnUjluVS1xUUROaEV2OG1Pb1U3WHB5YnU0aXhBZVJHQ0Z4ZTlSX2dfZjBHVVc2cG1OWTRWMWZJaExsX294UzJWZUtmdFJuNENDX3dEcmxUWFNWeXlvQnVCenZRNmpsSmJCZERFZmVvRzNOWW9LeVJoWVE?oc=5&hl=en-CA&gl=CA&ceid=CA:en,"Mon, 06 Feb 2023 08:00:00 GMT","{'href': 'https://www.cnn.com', 'title': 'CNN'}"
Manhattan DA presenting evidence in Trump-Stormy Daniels investigation to grand jury - NPR,Manhattan DA presenting evidence in Trump-Stormy Daniels investigation to grand jury  NPR,https://news.google.com/rss/articles/CBMivwFBVV95cUxQWGhnbkIxeW1JUkhCOXlrX05MUm5tZ0dwQWhwXzhZMk5xSWdVOEtUcC1ReS04V2VnTVZrZFoyWXgtMnRCNGM5cTlpX1h6bmNVd0xxdWpzN3JhQVhIWDNSSENnSThmUUYtano5LWhVaEUydXY1TXlmT3lDTVFQSEVFTmdLdGtrblkyX0hBVTJidFZLb1RJYlc2THZxSGpncDRmRHZCeDFMbjEzbVZGZEJMeG9PUVY4NDZJWlVPTGw1VQ?oc=5&hl=en-CA&gl=CA&ceid=CA:en,"Mon, 30 Jan 2023 08:00:00 GMT","{'href': 'https://www.npr.org', 'title': 'NPR'}"
Judge to Trump: Too late to offer DNA to rebut rape claim - AP News,Judge to Trump: Too late to offer DNA to rebut rape claim  AP News,https://news.google.com/rss/articles/CBMiugFBVV95cUxNc00xTHgtbVJzc3FObWFvaGVGY0tmdWVNU2RHaV9FWHJSXzBnckR3QWpXX2F2OEFLdy1MWGZWRElub0VZY1pHenRXYkE1V0tkMnNQUzcxYUdUTmNhUDQtakczeWRXaHBoSkJEMFJrQmRtYzZGNTJlNUE1LWJIY19fRHRvZGZyZk1lcUs1TXhFUmY3WVZxMmJYV1BBSEdQN1NNZmdlakJyOW9wLThYYmZTWjFRaGF3ZjN0eWc?oc=5&hl=en-CA&gl=CA&ceid=CA:en,"Wed, 15 Feb 2023 08:00:00 GMT","{'href': 'https://apnews.com', 'title': 'AP News'}"
Koch-backed group plans to help Trump's GOP rivals in 2024 - CBS News,Koch-backed group plans to help Trump's GOP rivals in 2024  CBS News,https://news.google.com/rss/articles/CBMipgFBVV95cUxPV0JheWVmYVp4TmlIX3daYjF3VkZaTDFhQnl3aUxWQjl5a0VMbXRBamJlOEt1S1piZTVjakNPby11bFp1NWVUVVg1TGZzc1V3Q2JaWU13TkJtb0FLNVJJdTVTMzhHeENBcmlzS280WXZWWk1RYkJqU3dKbXEtcTFVamFqLXFkT05CclpXczNnZ2NfNjRiVUVDYzUtZm5YX015d25wN2NB0gGrAUFVX3lxTE9SNkhpMkZVNFVpaFRZUXNlMGxvNkw5RkZLSHVfaGl3bFZFNGczd3NZclVUSXptMjJxRFZpWkdmcHFSR19rVEdJVVI2RUpTUnREcm8wYUxnQmdQdjVGR2pndVctV2ZSdGtWeFJ2R291RVlhVFkwOFh2SXRCVGlJTkRGSmNRM2R0TmV5LVRkcThEb05CcmI2UXMyOUs2T0tRWkN2bjJCVF9oXzhLYw?oc=5&hl=en-CA&gl=CA&ceid=CA:en,"Mon, 06 Feb 2023 08:00:00 GMT","{'href': 'https://www.cbsnews.com', 'title': 'CBS News'}"
"Appeals court rules Trump must pay $110,000 fine for contempt - CBS News","Appeals court rules Trump must pay $110,000 fine for contempt  CBS News",https://news.google.com/rss/articles/CBMikwFBVV95cUxObmNpd0ItSU9DbUlrclJDZU5nTm9wWEZoYzRranlyc1Nha3Z6czVMakZSTTVsM1h3cEVwdU0yVDFvdm9PMFc2TG5nbDBvTXk2U3hWLVhtbWJyU2Q4LTdpN2paRmtTOG0xWlltVER6MVZjRDNBa2VvR0psYmh3Qm4xeUZ2Y1Y3TkdXZ29OdmZQWF9QRnfSAZgBQVVfeXFMTlFjemZ5U3B4UE9tdmo1YXJHT3FndU9kaGRoR1B6VmJxcktEOHhfbTNlMmctNFRsN1pmUmhFcUVueWxlUTFIR01iZlNHRzRjNERHN1piRURxcWVwdFJ0M1MxR0t3bnVDWEptWTVhR2cxNU1BMzZIQlZrVHpxcU9kdzdtcXhod205YzVVNlJLaTVyVkRFSldQeVk?oc=5&hl=en-CA&gl=CA&ceid=CA:en,"Tue, 14 Feb 2023 08:00:00 GMT","{'href': 'https://www.cbsnews.com', 'title': 'CBS News'}"
"After Attacking Mail-in Voting for Years, Trump Now Supports Drop Boxes - Democracy Docket","After Attacking Mail-in Voting for Years, Trump Now Supports Drop Boxes  Democracy Docket",https://news.google.com/rss/articles/CBMitgFBVV95cUxPVWhKQ2Z6Q25TRXprUUM0QmVhWEtaeXprc3dKRUlUYklnNlZtWG1kbFkwM2NtS3ZHaUl1aUxSWnEtSTFCVWdaOFNGX3E5ZjNRYjNXdjBsbGtScm11NHMwd3l0dHVwMVQtcFhfYTB3eDdzVk9fc2RaNjdYTnFWUmxfQk9OQ19sbE5iaGdWSHJmd3d1Qmc0WjhnV1pIcFd6NVdSQXo5OEYxdmRRUWR3eThWVDkzMlFPQQ?oc=5&hl=en-CA&gl=CA&ceid=CA:en,"Fri, 03 Feb 2023 08:00:00 GMT","{'href': 'https://www.democracydocket.com', 'title': 'Democracy Docket'}"
"Donald Trump sues Bob Woodward, claims journalist's audiobook violates copyright - CBS News","Donald Trump sues Bob Woodward, claims journalist's audiobook violates copyright  CBS News",https://news.google.com/rss/articles/CBMijgFBVV95cUxPVW1uOXRFQUZxSVZGcUFvVkhMZ2tuc1Q1QTZzOVh6SXdKYkdnTFNHaWtSNnNxTy0yUlVnVlJHLWJWb3NsRzFFSXAzMVhUN1ZZS0FIMTVYVXdjY202VHp5WjVYd2pka3pLTVZwWDFuSnRwdXkwUjh4VndJenl1bkhzRjliZjFfcE9XVFg0V2xn0gGTAUFVX3lxTFBaQWxaLVI4VlpmSGdpclNqTl9Qb2VvLUNMNTgzbVdyUDE2N2lvU3k1c2NpX1RQTGRKZXFvVUt1bFJQS0cxbmF0cGZuMmFkZzVSNUhtajR6UUN5VjFCRzNuODdyZG1USTFsVGZRWWp5VGpyODdLVVJrYnk3UVByQVo5bXhwS1lmNW93V2VsUU81XzdLRQ?oc=5&hl=en-CA&gl=CA&ceid=CA:en,"Tue, 31 Jan 2023 08:00:00 GMT","{'href': 'https://www.cbsnews.com', 'title': 'CBS News'}"
Ex-prosecutor’s new book details fight over indicting Trump - AP News,Ex-prosecutor’s new book details fight over indicting Trump  AP News,https://news.google.com/rss/articles/CBMisgFBVV95cUxPOWI3LU0tV2FSaEpVOFd2czhtVXhJNnJTQmYtRFlCSUhCRFpBdzRBMTlVSGsyN3NRTHM3VnBldTM2dHhqdVBJN01MajhiZldSeWx6N2h1MVgtUWlJTDhnaGo5ZGlmZHFTZnJtbjhrUExDRy1TZWtwcS1qSGF2YnFpb29oaU9xS2hQLXR6eEMwbC1yaGU4MTFRbURmWEVLcVJsU1ZCdUVDOUVUZVMzRmR5dWZB?oc=5&hl=en-CA&gl=CA&ceid=CA:en,"Fri, 03 Feb 2023 08:00:00 GMT","{'href': 'https://apnews.com', 'title': 'AP News'}"
